,path,title,img_url,full_link,label
125,8va4xz.jpg,Thought you guys might appreciate this,https://i.redd.it/9bt3lvlpgc711.jpg,https://www.reddit.com/r/shittyfoodporn/comments/8va4xz/thought_you_guys_might_appreciate_this/,['odd']
126,cd8cna.jpg,We had no more hamburger buns so we decided to improvise with a hotdog bun to make the “Long Burger”,https://i.redd.it/ciyyhnyn4ca31.jpg,https://www.reddit.com/r/shittyfoodporn/comments/cd8cna/we_had_no_more_hamburger_buns_so_we_decided_to/,['poor man']
127,cznz29.jpg,ight imma head out,https://i.redd.it/xekj5t414mk31.jpg,https://www.reddit.com/r/shittyfoodporn/comments/cznz29/ight_imma_head_out/,['bad exe']
128,6zhczh.jpg,Ketchup Soup,https://i.redd.it/dm4adljptalz.jpg,https://www.reddit.com/r/shittyfoodporn/comments/6zhczh/ketchup_soup/,['gross']
129,8zyj8z.jpg,"2 dry leftover patties, 1/2 of a functional bun: behold, the Inverse Burger (with mayo and A-1)",https://i.redd.it/aavw3ksmbra11.jpg,https://www.reddit.com/r/shittyfoodporn/comments/8zyj8z/2_dry_leftover_patties_12_of_a_functional_bun/,['poor man']
130,9cvnam.jpg,pie,https://i.redd.it/lusi6emc58k11.jpg,https://www.reddit.com/r/shittyfoodporn/comments/9cvnam/pie/,['bad exe']
131,7nhlke.jpg,"Because why the fuck not. 2018, we’re ready for you!!",https://i.redd.it/x7m5d51dti701.jpg,https://www.reddit.com/r/shittyfoodporn/comments/7nhlke/because_why_the_fuck_not_2018_were_ready_for_you/,['odd']
132,99y5l3.jpg,"My electric pepper grinder is stuck on ""max coarse""",https://i.imgur.com/FT7e1F6.jpg,https://www.reddit.com/r/shittyfoodporn/comments/99y5l3/my_electric_pepper_grinder_is_stuck_on_max_coarse/,['overkill']
133,85itg7.jpg,Glockamole,https://i.redd.it/h9g1vg6ejpm01.jpg,https://www.reddit.com/r/shittyfoodporn/comments/85itg7/glockamole/,['odd']
134,6w10zh.jpg,The pizza was actually delivered like this...,http://i.imgur.com/lnFX7Aw.jpg,https://www.reddit.com/r/shittyfoodporn/comments/6w10zh/the_pizza_was_actually_delivered_like_this/,['bad exe']
135,85at10.jpg,Speghetti and Shitballs,https://i.redd.it/0roms1jdhim01.jpg,https://www.reddit.com/r/shittyfoodporn/comments/85at10/speghetti_and_shitballs/,['bad exe']
136,avts7c.png,"Apparently, he ate the leftovers for breakfast",https://i.redd.it/es6tbvnvhcj21.png,https://www.reddit.com/r/shittyfoodporn/comments/avts7c/apparently_he_ate_the_leftovers_for_breakfast/,['gross']
137,b2jvd1.jpg,My flatmate’s usual uni dinner,https://i.redd.it/pmmmicwv8wm21.jpg,https://www.reddit.com/r/shittyfoodporn/comments/b2jvd1/my_flatmates_usual_uni_dinner/,['poor man']
138,7rqswh.jpg,Banana Bread,https://i.imgur.com/YNkLfDP.jpg,https://www.reddit.com/r/shittyfoodporn/comments/7rqswh/banana_bread/,['bad exe']
139,cer9z6.jpg,I see your soggy aeroplane pizza slice and raise you an aeroplane omelette.,https://i.redd.it/fhfz086ds1b31.jpg,https://www.reddit.com/r/shittyfoodporn/comments/cer9z6/i_see_your_soggy_aeroplane_pizza_slice_and_raise/,['bad exe']
140,dp9ixh.png,This sweet potato that grew in my garden. Just ew.,https://i.redd.it/7r12dw6dnpv31.png,https://www.reddit.com/r/shittyfoodporn/comments/dp9ixh/this_sweet_potato_that_grew_in_my_garden_just_ew/,['odd']
141,601d1v.jpg,"My Mom's ""traditional"" St. Patrick's Day dinner. Doesn't it look appetizing?!",http://i.imgur.com/z2Jr5VS.jpg,https://www.reddit.com/r/shittyfoodporn/comments/601d1v/my_moms_traditional_st_patricks_day_dinner_doesnt/,['bad exe']
142,c7rzd9.jpg,My husband’s eggs that he made in the microwave.,https://i.redd.it/ykj9u8dhro731.jpg,https://www.reddit.com/r/shittyfoodporn/comments/c7rzd9/my_husbands_eggs_that_he_made_in_the_microwave/,['poor man']
143,ca6ply.jpg,I went to a county fair and I saw God.,https://i.redd.it/iz66zdszsv831.jpg,https://www.reddit.com/r/shittyfoodporn/comments/ca6ply/i_went_to_a_county_fair_and_i_saw_god/,['overkill']
144,b1rlwh.jpg,Toast sandwich,https://i.redd.it/u4orkugrxgm21.jpg,https://www.reddit.com/r/shittyfoodporn/comments/b1rlwh/toast_sandwich/,['poor man']
145,cbxtst.png,"Everyone makes fun of pineapple pizza, but the Germans took it one step further with their ""Toast Hawaii"" - ham and cheese, with cherry and a hot broiled slice of pineapple to melt the cheese, on a slice of bread",https://i.imgur.com/IwAKI4E.png,https://www.reddit.com/r/shittyfoodporn/comments/cbxtst/everyone_makes_fun_of_pineapple_pizza_but_the/,['gross']
146,86per5.jpg,Sushi Soup,https://i.redd.it/8bhks2dmgen01.jpg,https://www.reddit.com/r/shittyfoodporn/comments/86per5/sushi_soup/,['gross']
147,90fry8.jpg,A s’more made with S’mores Pop-tarts,https://i.redd.it/g6py57fgp3b11.jpg,https://www.reddit.com/r/shittyfoodporn/comments/90fry8/a_smore_made_with_smores_poptarts/,['overkill']
148,cu1og6.png,Mmmm shapes,https://i.redd.it/egceahw9p1i31.png,https://www.reddit.com/r/shittyfoodporn/comments/cu1og6/mmmm_shapes/,['gross']
149,g121jh.jpg,This was my dad’s submission for the family quarantine cook off this week.. Terrifying.,https://i.redd.it/qk9ic444zqs41.jpg,https://www.reddit.com/r/shittyfoodporn/comments/g121jh/this_was_my_dads_submission_for_the_family/,['bad exe']
150,662u9c.jpg,McDonald's double cheeseburger with extra staff member's glove...,https://i.redd.it/70d2sapqdbsy.jpg,https://www.reddit.com/r/shittyfoodporn/comments/662u9c/mcdonalds_double_cheeseburger_with_extra_staff/,['gross']
151,bylv7c.jpg,Not sure if violation of rule 2...,https://i.redd.it/p4btc3tkvc331.jpg,https://www.reddit.com/r/shittyfoodporn/comments/bylv7c/not_sure_if_violation_of_rule_2/,['gross']
152,9gsugx.jpg,"Tender chicken, pommes-sourires, petit pois and tomato jus",https://i.redd.it/i51szc9deym11.jpg,https://www.reddit.com/r/shittyfoodporn/comments/9gsugx/tender_chicken_pommessourires_petit_pois_and/,['good exe']
153,8shfi2.jpg,"This ""Poutine"" found on r/food",https://i.redd.it/rzfojwr025511.jpg,https://www.reddit.com/r/shittyfoodporn/comments/8shfi2/this_poutine_found_on_rfood/,['bad exe']
154,c2hk6j.jpg,"Wanted some pizza. This was the best I could come up with with. Canned pizza sauce, Gouda, cheddar, and salami on a toasted hot dog bun.",https://i.redd.it/5kmpd5gimb531.jpg,https://www.reddit.com/r/shittyfoodporn/comments/c2hk6j/wanted_some_pizza_this_was_the_best_i_could_come/,['poor man']
155,cx33dl.png,"Vegan apple patty on potato roll, served on a glazed oak plank",https://i.imgur.com/1rHAAHQ.png,https://www.reddit.com/r/shittyfoodporn/comments/cx33dl/vegan_apple_patty_on_potato_roll_served_on_a/,['poor man']
156,dlkb2s.jpg,i do love my pasta shells,https://i.redd.it/jh9afe7cc4u31.jpg,https://www.reddit.com/r/shittyfoodporn/comments/dlkb2s/i_do_love_my_pasta_shells/,['gross']
157,7m8c22.jpg,I saw this and I immediately thought of this sub,https://i.redd.it/ql3vdwvkca601.jpg,https://www.reddit.com/r/shittyfoodporn/comments/7m8c22/i_saw_this_and_i_immediately_thought_of_this_sub/,['bad exe']
158,bc7xlv.jpg,This bottle of ranch is turning 20 years old today,https://i.redd.it/gvlv7whujqr21.jpg,https://www.reddit.com/r/shittyfoodporn/comments/bc7xlv/this_bottle_of_ranch_is_turning_20_years_old_today/,['gross']
159,69st8h.jpg,Gushers sandwich on Fruit by the Foot bread,https://i.redd.it/2dtu7bzse4wy.jpg,https://www.reddit.com/r/shittyfoodporn/comments/69st8h/gushers_sandwich_on_fruit_by_the_foot_bread/,['overkill']
160,8z9xul.jpg,Dinosaur Cake from an actual bakery (£12),https://i.redd.it/rb0y29gcjaa11.jpg,https://www.reddit.com/r/shittyfoodporn/comments/8z9xul/dinosaur_cake_from_an_actual_bakery_12/,['bad exe']
161,961zb7.jpg,"Richard Nixon’s Last Lunch in the White House, 1974",https://i.redd.it/mmamktuur5f11.jpg,https://www.reddit.com/r/shittyfoodporn/comments/961zb7/richard_nixons_last_lunch_in_the_white_house_1974/,['odd']
162,b5c4yf.jpg,Our $5.00 school lunch today.,https://i.redd.it/phks8jt5bao21.jpg,https://www.reddit.com/r/shittyfoodporn/comments/b5c4yf/our_500_school_lunch_today/,['bad exe']
163,arz2af.jpg,I just wanted to make a pizza cat. 🙄,https://i.imgur.com/XjEgbau.jpg,https://www.reddit.com/r/shittyfoodporn/comments/arz2af/i_just_wanted_to_make_a_pizza_cat/,['bad exe']
164,7ra2l3.jpg,Hy-Vee Tide Pod Donuts,https://i.redd.it/zog6rv6m7ua01.jpg,https://www.reddit.com/r/shittyfoodporn/comments/7ra2l3/hyvee_tide_pod_donuts/,['good exe']
165,bs2z46.jpg,Worst Meatloaf Ever,https://i.redd.it/3folxrsjpyz21.jpg,https://www.reddit.com/r/shittyfoodporn/comments/bs2z46/worst_meatloaf_ever/,['gross']
166,60cq7x.jpg,Ill just wait for my Michelin star now...,https://i.redd.it/k9q3qhhbufmy.jpg,https://www.reddit.com/r/shittyfoodporn/comments/60cq7x/ill_just_wait_for_my_michelin_star_now/,['good exe']
167,cig265.jpg,A sandwich of extremely tiny prawns and cold butter.,https://i.redd.it/nzmfc6dwrtc31.jpg,https://www.reddit.com/r/shittyfoodporn/comments/cig265/a_sandwich_of_extremely_tiny_prawns_and_cold/,['gross']
168,ddnkb4.jpg,This is an abomination,https://i.redd.it/1vdv67miaqq31.jpg,https://www.reddit.com/r/shittyfoodporn/comments/ddnkb4/this_is_an_abomination/,['gross']
169,5oyd8z.jpg,"What the fuck is ""ogre green creamy filling'!?!?",http://i.imgur.com/ddaRpHp.jpg,https://www.reddit.com/r/shittyfoodporn/comments/5oyd8z/what_the_fuck_is_ogre_green_creamy_filling/,['odd']
170,cf5vqw.jpg,Supposedly this is Philly cheesesteak. Served onboard the fabulous USS JOHN C. STENNIS. Let me know if you’d like to see more of their culinary masterpieces.,https://i.redd.it/4dwqrec2m8b31.jpg,https://www.reddit.com/r/shittyfoodporn/comments/cf5vqw/supposedly_this_is_philly_cheesesteak_served/,['gross']
171,cdrgnt.jpg,Dino-empanadas,https://i.redd.it/3y2s4ijpzka31.jpg,https://www.reddit.com/r/shittyfoodporn/comments/cdrgnt/dinoempanadas/,['good exe']
172,91hubd.jpg,a bag of noodles,https://i.redd.it/deuo1qqbowb11.jpg,https://www.reddit.com/r/shittyfoodporn/comments/91hubd/a_bag_of_noodles/,['odd']
173,6tf6xe.jpg,Saw this over in /Trashy,https://i.redd.it/z6om2t6afifz.jpg,https://www.reddit.com/r/shittyfoodporn/comments/6tf6xe/saw_this_over_in_trashy/,['gross']
174,9h7gno.jpg,"""Mexican Sushi""",https://i.redd.it/kh18oznpi8n11.jpg,https://www.reddit.com/r/shittyfoodporn/comments/9h7gno/mexican_sushi/,['good exe']
175,cjvlox.jpg,"My wife told me to ""eat a bowl of cereal"" for breakfast. This counts.. Right?",https://i.redd.it/mkapmas1ehd31.jpg,https://www.reddit.com/r/shittyfoodporn/comments/cjvlox/my_wife_told_me_to_eat_a_bowl_of_cereal_for/,['overkill']
176,au97f9.jpg,nice,https://i.imgur.com/tKEtZnp.jpg,https://www.reddit.com/r/shittyfoodporn/comments/au97f9/nice/,['odd']
177,cw8ohe.jpg,I finally learned how to garnish,https://i.redd.it/z80uneeje1j31.jpg,https://www.reddit.com/r/shittyfoodporn/comments/cw8ohe/i_finally_learned_how_to_garnish/,['good exe']
178,6ygzqq.jpg,Shitty Cake.,https://i.redd.it/a7azv6hfpakz.jpg,https://www.reddit.com/r/shittyfoodporn/comments/6ygzqq/shitty_cake/,['bad exe']
179,9f6r35.jpg,"We tried making a cake for my mom’s birthday. Problem is, we have no experience with making cakes",https://i.redd.it/vikqsbzrisl11.jpg,https://www.reddit.com/r/shittyfoodporn/comments/9f6r35/we_tried_making_a_cake_for_my_moms_birthday/,['bad exe']
180,cwkr7e.jpg,Dot Hog,https://i.redd.it/k4rz9uqqx6j31.jpg,https://www.reddit.com/r/shittyfoodporn/comments/cwkr7e/dot_hog/,['poor man']
181,7lvn2s.png,Pop tart pie,https://i.imgur.com/JdMUVt6.png,https://www.reddit.com/r/shittyfoodporn/comments/7lvn2s/pop_tart_pie/,['overkill']
182,huwwtk.jpg,"My mom passed her board exam and I wanted to bake a cake for her. Everything is from scratch and it tastes delicious, I’m just a shitty decorator",https://i.redd.it/awltsqbvp3c51.jpg,https://www.reddit.com/r/shittyfoodporn/comments/huwwtk/my_mom_passed_her_board_exam_and_i_wanted_to_bake/,['bad exe']
183,aspax7.jpg,Jabbocado on Toast,https://i.imgur.com/c5hzGKu.jpg,https://www.reddit.com/r/shittyfoodporn/comments/aspax7/jabbocado_on_toast/,['odd']
184,9i60p4.jpg,LPT: If you add pepper and a nice plate it looks less like poverty,https://i.imgur.com/6guO6zM.jpg,https://www.reddit.com/r/shittyfoodporn/comments/9i60p4/lpt_if_you_add_pepper_and_a_nice_plate_it_looks/,['poor man']
185,b7n5p0.jpg,"Cheese and pickle taco, exactly as requested by my 4 year old daughter.",https://i.redd.it/s7br87mc5gp21.jpg,https://www.reddit.com/r/shittyfoodporn/comments/b7n5p0/cheese_and_pickle_taco_exactly_as_requested_by_my/,['gross']
186,6fdt2j.jpg,I made a pizza,https://i.redd.it/q0h47dv9kt1z.jpg,https://www.reddit.com/r/shittyfoodporn/comments/6fdt2j/i_made_a_pizza/,['bad exe']
187,81q5rw.jpg,"Who cares at this point, at least I’m happy while having a heartattack",https://i.imgur.com/495FW7i.jpg,https://www.reddit.com/r/shittyfoodporn/comments/81q5rw/who_cares_at_this_point_at_least_im_happy_while/,['overkill']
188,bk4xiz.jpg,I found the official Sprite lemon in my fridge,https://i.redd.it/tsbrrvpnoxv21.jpg,https://www.reddit.com/r/shittyfoodporn/comments/bk4xiz/i_found_the_official_sprite_lemon_in_my_fridge/,['gross']
189,bzumao.jpg,Local grocery store keeping it original.,https://i.redd.it/x4et1zk4vy331.jpg,https://www.reddit.com/r/shittyfoodporn/comments/bzumao/local_grocery_store_keeping_it_original/,['gross']
190,awk6fv.jpg,Green eggs and ham for Dr. Seuss’s birthday!,https://i.redd.it/2zq9lq24tqj21.jpg,https://www.reddit.com/r/shittyfoodporn/comments/awk6fv/green_eggs_and_ham_for_dr_seusss_birthday/,['bad exe']
191,bu0syu.jpg,"I swear it’s a smoothie, not raw sewage.",https://i.redd.it/7r1e95fkry031.jpg,https://www.reddit.com/r/shittyfoodporn/comments/bu0syu/i_swear_its_a_smoothie_not_raw_sewage/,['gross']
192,h7iupi.jpg,Behold the egg cake,https://i.redd.it/5mv5zoswqg451.jpg,https://www.reddit.com/r/shittyfoodporn/comments/h7iupi/behold_the_egg_cake/,['overkill']
193,aul6jh.jpg,Somebody posted a shrek cake one time and i had to recreate it,https://i.redd.it/hobztmintpi21.jpg,https://www.reddit.com/r/shittyfoodporn/comments/aul6jh/somebody_posted_a_shrek_cake_one_time_and_i_had/,['good exe']
194,ar93gq.jpg,Naan kebab wrapped in Domino’s cheese pizza 👌,https://i.redd.it/totzx2yduxg21.jpg,https://www.reddit.com/r/shittyfoodporn/comments/ar93gq/naan_kebab_wrapped_in_dominos_cheese_pizza/,['overkill']
195,8nk0e2.jpg,saw this on twitter and logged off immediately,https://i.redd.it/9f52hcqf18111.jpg,https://www.reddit.com/r/shittyfoodporn/comments/8nk0e2/saw_this_on_twitter_and_logged_off_immediately/,['gross']
196,cgey9q.png,So cannabis legalization in Canada is going well.,https://i.redd.it/ynekes5tmvb31.png,https://www.reddit.com/r/shittyfoodporn/comments/cgey9q/so_cannabis_legalization_in_canada_is_going_well/,['overkill']
197,crvzmz.jpg,"So the wife’s had a few drinks and hands me this low carb chili burger, it’s been 10 minutes she’s still laughing",https://i.redd.it/mcgh368mi4h31.jpg,https://www.reddit.com/r/shittyfoodporn/comments/crvzmz/so_the_wifes_had_a_few_drinks_and_hands_me_this/,['gross']
198,cfy8ft.jpg,Pineapple pizza=shittyfoodporn,https://i.redd.it/7lclknsibnb31.jpg,https://www.reddit.com/r/shittyfoodporn/comments/cfy8ft/pineapple_pizzashittyfoodporn/,['odd']
199,885duk.jpg,Friend used food processor on red skinned potatoes before boiling them “for faster mashed potatoes”,https://i.redd.it/tydqt0rszro01.jpg,https://www.reddit.com/r/shittyfoodporn/comments/885duk/friend_used_food_processor_on_red_skinned/,['gross']
200,6w6qnx.jpg,Canned sardines on a hotdog roll.,https://i.redd.it/ji4932vq74iz.jpg,https://www.reddit.com/r/shittyfoodporn/comments/6w6qnx/canned_sardines_on_a_hotdog_roll/,['poor man']
201,bllmn6.jpg,My school’s egg salad,https://i.redd.it/7mxp67qrhpw21.jpg,https://www.reddit.com/r/shittyfoodporn/comments/bllmn6/my_schools_egg_salad/,['bad exe']
202,cgqa3j.jpg,The Clementine of man,https://i.imgur.com/256kXKn.jpg,https://www.reddit.com/r/shittyfoodporn/comments/cgqa3j/the_clementine_of_man/,['good exe']
203,ayxsgz.jpg,My roommate... oh no. He was gonna put this on a plate with A1 sauce.,https://i.redd.it/jwnpy5b2szk21.jpg,https://www.reddit.com/r/shittyfoodporn/comments/ayxsgz/my_roommate_oh_no_he_was_gonna_put_this_on_a/,['gross']
204,b5ojpy.jpg,Not my creation but I thaught I might share it with you guys,https://i.redd.it/qjo31brg8go21.jpg,https://www.reddit.com/r/shittyfoodporn/comments/b5ojpy/not_my_creation_but_i_thaught_i_might_share_it/,['gross']
205,6429gw.png,"My college's ""fish tacos""",http://i.imgur.com/soeCSoN.png,https://www.reddit.com/r/shittyfoodporn/comments/6429gw/my_colleges_fish_tacos/,['bad exe']
206,7u3bvx.jpg,"Brought in a peeled, baked sweet potato as a snack today during work",https://i.imgur.com/lEA3brK.jpg,https://www.reddit.com/r/shittyfoodporn/comments/7u3bvx/brought_in_a_peeled_baked_sweet_potato_as_a_snack/,['poor man']
207,begpj0.jpg,Didn't have shredded cheese but wanted tacos.,https://i.redd.it/3m5yhr0qvxs21.jpg,https://www.reddit.com/r/shittyfoodporn/comments/begpj0/didnt_have_shredded_cheese_but_wanted_tacos/,['poor man']
208,7ig0ux.jpg,Homemade potato chip,https://i.redd.it/m91q194g5q201.jpg,https://www.reddit.com/r/shittyfoodporn/comments/7ig0ux/homemade_potato_chip/,['gross']
209,davxg8.jpg,chocolate chip pancakes over a bowl of vanilla icecream at 9am,https://i.redd.it/h3yj0kd5ojp31.jpg,https://www.reddit.com/r/shittyfoodporn/comments/davxg8/chocolate_chip_pancakes_over_a_bowl_of_vanilla/,['overkill']
210,8cwd1d.jpg,Sushizza,http://www.emok.tv/wp-content/gallery/emok_picdump_549/thumbs/thumbs_EMOK_Picdump_549_046.jpg,https://www.reddit.com/r/shittyfoodporn/comments/8cwd1d/sushizza/,['good exe']
211,c9plx1.jpg,We requested a friends themed cake,https://i.redd.it/dogfxxn95m831.jpg,https://www.reddit.com/r/shittyfoodporn/comments/c9plx1/we_requested_a_friends_themed_cake/,['bad exe']
212,c3ao49.jpg,Kebab sandwich looking like a smoker's lung,https://i.redd.it/zt39tn6mqp531.jpg,https://www.reddit.com/r/shittyfoodporn/comments/c3ao49/kebab_sandwich_looking_like_a_smokers_lung/,['bad exe']
213,5pbwhb.jpg,[I ate] a sandwich.,http://i.imgur.com/iWi7bb2.jpg,https://www.reddit.com/r/shittyfoodporn/comments/5pbwhb/i_ate_a_sandwich/,['odd']
214,av8tsl.jpg,Clearing out the freezer in style.,https://i.redd.it/2lmoe4nha1j21.jpg,https://www.reddit.com/r/shittyfoodporn/comments/av8tsl/clearing_out_the_freezer_in_style/,['overkill']
215,dn3a97.png,Homemade grilled cheese but it’s not grilled and I just put some shredded cheese in between some bread and threw it in the microwave,https://i.redd.it/ygazus1eyqu31.png,https://www.reddit.com/r/shittyfoodporn/comments/dn3a97/homemade_grilled_cheese_but_its_not_grilled_and_i/,['poor man']
216,d0jfr0.jpg,"Tried making katsu, came out like shatsu.",https://i.redd.it/rbkoltxj90l31.jpg,https://www.reddit.com/r/shittyfoodporn/comments/d0jfr0/tried_making_katsu_came_out_like_shatsu/,['bad exe']
217,9cmp2e.jpg,This shouldn’t exist.,https://i.redd.it/vggmxc90s1k11.jpg,https://www.reddit.com/r/shittyfoodporn/comments/9cmp2e/this_shouldnt_exist/,['gross']
218,bucuer.jpg,Me and my friends melted a kilogram of fruity chews into one large fruity chew,https://i.redd.it/hx4c1yerl4131.jpg,https://www.reddit.com/r/shittyfoodporn/comments/bucuer/me_and_my_friends_melted_a_kilogram_of_fruity/,['overkill']
219,7gmt57.jpg,As a native Texan living in NC I was so excited to finally find a restaurant with Pigs in a Blanket. Was 100% disappointed.,https://i.redd.it/gcnvxvw4l4101.jpg,https://www.reddit.com/r/shittyfoodporn/comments/7gmt57/as_a_native_texan_living_in_nc_i_was_so_excited/,['bad exe']
220,67xw69.jpg,So my local pizza joint got a new chef...,http://i.imgur.com/zQlBqMP.jpg,https://www.reddit.com/r/shittyfoodporn/comments/67xw69/so_my_local_pizza_joint_got_a_new_chef/,['bad exe']
221,bz8ohq.jpg,Saw this on Twitter,https://i.redd.it/jdcc8chy1o331.jpg,https://www.reddit.com/r/shittyfoodporn/comments/bz8ohq/saw_this_on_twitter/,['gross']
222,cdguao.jpg,The madmen at Heinz must be stopped,https://i.redd.it/uykbk7exnga31.jpg,https://www.reddit.com/r/shittyfoodporn/comments/cdguao/the_madmen_at_heinz_must_be_stopped/,['gross']
223,cl34of.jpg,Crustless Pepperoni Pizza,https://i.redd.it/mod3pktmy0e31.jpg,https://www.reddit.com/r/shittyfoodporn/comments/cl34of/crustless_pepperoni_pizza/,['poor man']
224,btk1ui.jpg,[i ate] bulk cheddar cheese powder mac n cheese. Shit tastes like straight cheetos dust.,https://i.imgur.com/m3shFOj.jpg,https://www.reddit.com/r/shittyfoodporn/comments/btk1ui/i_ate_bulk_cheddar_cheese_powder_mac_n_cheese/,['overkill']
225,dc8tx7.jpg,Gourmet Potato Salad,https://i.imgur.com/uOY6lMi.jpg,https://www.reddit.com/r/shittyfoodporn/comments/dc8tx7/gourmet_potato_salad/,['poor man']
226,b10x20.jpg,"Hard boiled egg topped with Cheeto dust, straddling a month old block of Colby jack over a very stale hummus spread and a decent piece of dry salami",https://i.redd.it/4xgq5p1bg3m21.jpg,https://www.reddit.com/r/shittyfoodporn/comments/b10x20/hard_boiled_egg_topped_with_cheeto_dust/,['good exe']
227,7edi1n.jpg,Wa La,https://i.redd.it/rgh2f0l408zz.jpg,https://www.reddit.com/r/shittyfoodporn/comments/7edi1n/wa_la/,['overkill']
228,ck8bvq.jpg,"Wife's away day 4, still haven't run out of sausages 🤣",https://i.redd.it/gvmutmvd2nd31.jpg,https://www.reddit.com/r/shittyfoodporn/comments/ck8bvq/wifes_away_day_4_still_havent_run_out_of_sausages/,['poor man']
229,at2d2d.jpg,I’m going to eat a mussel eating a crab.,https://i.redd.it/oql2km91wwh21.jpg,https://www.reddit.com/r/shittyfoodporn/comments/at2d2d/im_going_to_eat_a_mussel_eating_a_crab/,['gross']
230,c8olmb.jpg,"Breakfast anyone? Heres some fruitloops my son ""saved for later"" in the freezer",https://i.redd.it/spa7klv1k3831.jpg,https://www.reddit.com/r/shittyfoodporn/comments/c8olmb/breakfast_anyone_heres_some_fruitloops_my_son/,['gross']
231,d7nsys.jpg,my boyfriend’s 1:30 am “breakfast ramen”,https://i.redd.it/rki9kpjox3o31.jpg,https://www.reddit.com/r/shittyfoodporn/comments/d7nsys/my_boyfriends_130_am_breakfast_ramen/,['poor man']
232,b3fxwq.jpg,"Did not know what I expected, but it was not this. ""Loaded"" baked potato, steak, and Mac n cheese",https://i.redd.it/h7mgaapinbn21.jpg,https://www.reddit.com/r/shittyfoodporn/comments/b3fxwq/did_not_know_what_i_expected_but_it_was_not_this/,['bad exe']
233,auyu6n.jpg,Flaky croissant wrapped hot dogs stuffed with creamy Velveeta resting on a savory bed of Wolf Brand chilli.,https://i.redd.it/t3wksywskjf21.jpg,https://www.reddit.com/r/shittyfoodporn/comments/auyu6n/flaky_croissant_wrapped_hot_dogs_stuffed_with/,['gross']
234,7dth3u.jpg,Wings food porn,https://i.redd.it/pt35tys23ryz.jpg,https://www.reddit.com/r/shittyfoodporn/comments/7dth3u/wings_food_porn/,['good exe']
235,5xemcv.jpg,Fruit pizza made by me - didn't know whether to post it here or on r/FoodPorn so decided to x-post and let the upvotes decide.,https://i.redd.it/lsyjiedfvajy.jpg,https://www.reddit.com/r/shittyfoodporn/comments/5xemcv/fruit_pizza_made_by_me_didnt_know_whether_to_post/,['gross']
236,8w38uj.jpg,“Fairy Bread” could be yours for $5 at the San Diego Wild Animal Park,https://i.redd.it/nsatc6s4ry711.jpg,https://www.reddit.com/r/shittyfoodporn/comments/8w38uj/fairy_bread_could_be_yours_for_5_at_the_san_diego/,['bad exe']
237,ch6e2p.jpg,The classic cheese and ham toastie,https://i.redd.it/shtl75nv98c31.jpg,https://www.reddit.com/r/shittyfoodporn/comments/ch6e2p/the_classic_cheese_and_ham_toastie/,['bad exe']
238,88byfv.jpg,"The Worst ""Key Lime Pie"" I've Ever Seen",https://i.redd.it/auem3annmxo01.jpg,https://www.reddit.com/r/shittyfoodporn/comments/88byfv/the_worst_key_lime_pie_ive_ever_seen/,['bad exe']
239,c4ozfg.jpg,my little sister had made this for me when i got home from abroad,https://i.redd.it/qzjou5t5gb631.jpg,https://www.reddit.com/r/shittyfoodporn/comments/c4ozfg/my_little_sister_had_made_this_for_me_when_i_got/,['bad exe']
240,5s1txz.jpg,"Deconstructed hot dog, served with chocolate milk",https://i.redd.it/vby7itlnlvdy.jpg,https://www.reddit.com/r/shittyfoodporn/comments/5s1txz/deconstructed_hot_dog_served_with_chocolate_milk/,['good exe']
241,8px1b6.jpg,Microwaved frozen chicken nuggets in jarred tikka masala sauce and leftover Chinese food rice.,https://i.redd.it/3gvhwhike2311.jpg,https://www.reddit.com/r/shittyfoodporn/comments/8px1b6/microwaved_frozen_chicken_nuggets_in_jarred_tikka/,['poor man']
242,7xxedv.jpg,Does this abomination count?,https://i.redd.it/o99i3stnbjg01.jpg,https://www.reddit.com/r/shittyfoodporn/comments/7xxedv/does_this_abomination_count/,['odd']
243,99ccgb.jpg,"Can I interest anyone with my peas, corn and glass?",https://i.redd.it/syzy00aqlmh11.jpg,https://www.reddit.com/r/shittyfoodporn/comments/99ccgb/can_i_interest_anyone_with_my_peas_corn_and_glass/,['bad exe']
244,6udx07.jpg,Reverse hotdog,https://i.redd.it/46mfdnwhtdgz.jpg,https://www.reddit.com/r/shittyfoodporn/comments/6udx07/reverse_hotdog/,['odd']
245,8rr2cc.jpg,"""Pizza"" I made after coming home drunk",https://i.redd.it/ky5a82ksdk411.jpg,https://www.reddit.com/r/shittyfoodporn/comments/8rr2cc/pizza_i_made_after_coming_home_drunk/,['bad exe']
246,df1g1g.png,A Facebook friend's actual birthday cake,https://i.redd.it/n9fcap494cr31.png,https://www.reddit.com/r/shittyfoodporn/comments/df1g1g/a_facebook_friends_actual_birthday_cake/,['odd']
247,c34c1n.jpg,Upsettingly moist gas station hotdog,https://i.redd.it/bqcue3hl4m531.jpg,https://www.reddit.com/r/shittyfoodporn/comments/c34c1n/upsettingly_moist_gas_station_hotdog/,['gross']
248,bpbn9f.jpg,This charcoal craze is pretty weird it's just burnt croissant that they're trying to make an easy buck off.,https://i.redd.it/8h4y5zf0cky21.jpg,https://www.reddit.com/r/shittyfoodporn/comments/bpbn9f/this_charcoal_craze_is_pretty_weird_its_just/,['bad exe']
249,7cnode.png,Local hero,https://i.redd.it/h077g48tdrxz.png,https://www.reddit.com/r/shittyfoodporn/comments/7cnode/local_hero/,['gross']
250,8evjxa.jpg,It gets worst the longer you look.,https://i.redd.it/marse7pme3u01.jpg,https://www.reddit.com/r/shittyfoodporn/comments/8evjxa/it_gets_worst_the_longer_you_look/,['gross']
