,path,title,img_url,full_link,label
251,83g71e.jpg,Got pizzas for an event at school. This is the vegetarian pizza,https://i.redd.it/3xbm722mryk01.jpg,https://www.reddit.com/r/shittyfoodporn/comments/83g71e/got_pizzas_for_an_event_at_school_this_is_the/,['bad exe']
252,cfq58d.jpg,Tapas for my cat,https://i.imgur.com/Titob6x.jpg,https://www.reddit.com/r/shittyfoodporn/comments/cfq58d/tapas_for_my_cat/,['good exe']
253,bo163c.jpg,Domino's Pizza in New Zealand has released spaghetti and pineapple pizza.,https://i.imgur.com/BFmbiSf.jpg,https://www.reddit.com/r/shittyfoodporn/comments/bo163c/dominos_pizza_in_new_zealand_has_released/,['gross']
254,7gz60z.jpg,"My Specialty crispy breaded chicken, paired with a tangy tomato vinaigrette, and served with a chilled glass of a hydrogen-oxygen cocktail",https://i.redd.it/08kc0wb8fe101.jpg,https://www.reddit.com/r/shittyfoodporn/comments/7gz60z/my_specialty_crispy_breaded_chicken_paired_with_a/,['poor man']
255,8tiqxm.jpg,One helping of wtf please,https://i.redd.it/ztp7vyjc2z511.jpg,https://www.reddit.com/r/shittyfoodporn/comments/8tiqxm/one_helping_of_wtf_please/,['gross']
256,b90oo6.jpg,This Mexican place around the corner sells carne asada French fry burritos with hot Cheetos in them. It's the most American burrito I've ever had and I love it.,https://i.redd.it/guiz9bsxz2q21.jpg,https://www.reddit.com/r/shittyfoodporn/comments/b90oo6/this_mexican_place_around_the_corner_sells_carne/,['overkill']
257,cj9f7a.jpg,Amazing meal,https://i.redd.it/dtemow4yy7d31.jpg,https://www.reddit.com/r/shittyfoodporn/comments/cj9f7a/amazing_meal/,['gross']
258,8qqysc.jpg,I'll have one 'Damn we should take the cat to the vet' taco please,https://i.redd.it/ruymj41thq311.jpg,https://www.reddit.com/r/shittyfoodporn/comments/8qqysc/ill_have_one_damn_we_should_take_the_cat_to_the/,['gross']
259,bbnud0.jpg,yummy yummy,https://i.redd.it/6h9tivo4ogr21.jpg,https://www.reddit.com/r/shittyfoodporn/comments/bbnud0/yummy_yummy/,['odd']
260,bqhy32.jpg,"Hot dogs I let boil too long. On wheat of course, for the health benefits.",https://i.redd.it/95h52q62o6z21.jpg,https://www.reddit.com/r/shittyfoodporn/comments/bqhy32/hot_dogs_i_let_boil_too_long_on_wheat_of_course/,['bad exe']
261,bozy2v.jpg,Petition to Make Seth Rogen a Mod.,https://i.imgur.com/pWRIIEI.jpg,https://www.reddit.com/r/shittyfoodporn/comments/bozy2v/petition_to_make_seth_rogen_a_mod/,['gross']
262,bzf111.jpg,Found this gem.,https://i.redd.it/e2xfrkc6dr331.jpg,https://www.reddit.com/r/shittyfoodporn/comments/bzf111/found_this_gem/,['gross']
263,c4h656.jpg,"I work at domino’s, and this is a pizza I had to make today",https://i.redd.it/hhr9fouvv7631.jpg,https://www.reddit.com/r/shittyfoodporn/comments/c4h656/i_work_at_dominos_and_this_is_a_pizza_i_had_to/,['gross']
264,b18248.jpg,Kinda creepy but ok,https://i.redd.it/2073dbs2f6m21.jpg,https://www.reddit.com/r/shittyfoodporn/comments/b18248/kinda_creepy_but_ok/,['bad exe']
265,b4ljob.jpg,"It's my birthday, so I treated myself to a leftover hot dog + cheese sandwich on whole wheat bread. I regret spending time on this.",https://i.redd.it/ies2r5n9iwn21.jpg,https://www.reddit.com/r/shittyfoodporn/comments/b4ljob/its_my_birthday_so_i_treated_myself_to_a_leftover/,['poor man']
266,72yyx0.jpg,Rice on rice,https://i.redd.it/cugeda9odloz.jpg,https://www.reddit.com/r/shittyfoodporn/comments/72yyx0/rice_on_rice/,['poor man']
267,73lvjc.jpg,Reheating some deep dish pizza in a hotel room,https://i.imgur.com/TwwQbAk.jpg,https://www.reddit.com/r/shittyfoodporn/comments/73lvjc/reheating_some_deep_dish_pizza_in_a_hotel_room/,['poor man']
268,b8sive.jpg,Cookie sub,https://i.redd.it/ng9qsd0dpyp21.jpg,https://www.reddit.com/r/shittyfoodporn/comments/b8sive/cookie_sub/,['gross']
269,c1v99j.jpg,Let me know if you want the recipe!,https://i.redd.it/ls8apqt1c0531.jpg,https://www.reddit.com/r/shittyfoodporn/comments/c1v99j/let_me_know_if_you_want_the_recipe/,['burnt']
270,8d2ay9.jpg,handmade pepperoni pizza with mozzarella cheese,https://i.redd.it/lzcirf9bwks01.jpg,https://www.reddit.com/r/shittyfoodporn/comments/8d2ay9/handmade_pepperoni_pizza_with_mozzarella_cheese/,['poor man']
271,bh7ad9.jpg,My mom was really glad you enioyed the rat meatloaf the last time so she made another. Just for you,https://i.redd.it/0flk6mb37eu21.jpg,https://www.reddit.com/r/shittyfoodporn/comments/bh7ad9/my_mom_was_really_glad_you_enioyed_the_rat/,['bad exe']
272,ce5l5j.jpg,Deep Fried Uncrustables with powdered sugar,https://i.redd.it/n4anpb7mera31.jpg,https://www.reddit.com/r/shittyfoodporn/comments/ce5l5j/deep_fried_uncrustables_with_powdered_sugar/,['overkill']
273,6j6r2i.jpg,💩 milkshakes from a local cafe,https://i.redd.it/u4jev9vvfj5z.jpg,https://www.reddit.com/r/shittyfoodporn/comments/6j6r2i/milkshakes_from_a_local_cafe/,['overkill']
274,6poiuv.jpg,Chicken in a can...,https://i.redd.it/3gpwn4ed9ybz.jpg,https://www.reddit.com/r/shittyfoodporn/comments/6poiuv/chicken_in_a_can/,['gross']
275,bm5519.jpg,My cement lookin' ass cake,https://i.imgur.com/8PqwRYt.jpg,https://www.reddit.com/r/shittyfoodporn/comments/bm5519/my_cement_lookin_ass_cake/,['bad exe']
276,d60fvl.jpg,This baked potato I got at work.,https://i.imgur.com/IJd5kwV.jpg,https://www.reddit.com/r/shittyfoodporn/comments/d60fvl/this_baked_potato_i_got_at_work/,['overkill']
277,c9ft99.jpg,Peanut Butter Nanner n Jelly Dog,https://i.redd.it/y0z4m50uih831.jpg,https://www.reddit.com/r/shittyfoodporn/comments/c9ft99/peanut_butter_nanner_n_jelly_dog/,['odd']
278,6p59is.jpg,The admins of r/food are being douchey and won't allow me to post these homemade smoked chicken wings because I'm new to reddit and don't have enough karma. Eyefuck these.,https://i.redd.it/2y56oatszfbz.jpg,https://www.reddit.com/r/shittyfoodporn/comments/6p59is/the_admins_of_rfood_are_being_douchey_and_wont/,['good exe']
279,co3kqs.jpg,Cream Cheese with a Side of Bagel,https://i.imgur.com/2BiXZhi.jpg,https://www.reddit.com/r/shittyfoodporn/comments/co3kqs/cream_cheese_with_a_side_of_bagel/,['gross']
280,90smec.jpg,A delicacy,https://imgur.com/qdZ6e1o.jpg,https://www.reddit.com/r/shittyfoodporn/comments/90smec/a_delicacy/,['gross']
281,br4262.jpg,Hungry man and $6 wine for my night off of work,https://i.redd.it/8ubunkt9tgz21.jpg,https://www.reddit.com/r/shittyfoodporn/comments/br4262/hungry_man_and_6_wine_for_my_night_off_of_work/,['poor man']
282,dkks0s.jpg,Rice Crispy “Hamburger Meat”,https://i.redd.it/f9p0i31copt31.jpg,https://www.reddit.com/r/shittyfoodporn/comments/dkks0s/rice_crispy_hamburger_meat/,['good exe']
283,5p6950.jpg,This abomination appeared on twitter.,https://i.imgur.com/z4dNsRP.jpg,https://www.reddit.com/r/shittyfoodporn/comments/5p6950/this_abomination_appeared_on_twitter/,['poor man']
284,c5our1.jpg,"Millionaires' Pizza - bagel bites, totino's pizza rolls, stouffer's french bread, pepperoni hot pocket.",https://i.redd.it/e12joywlvo631.jpg,https://www.reddit.com/r/shittyfoodporn/comments/c5our1/millionaires_pizza_bagel_bites_totinos_pizza/,['overkill']
285,bvnxh5.jpg,Hotdogs in the Instant Pot.,https://i.redd.it/ibkncykigs131.jpg,https://www.reddit.com/r/shittyfoodporn/comments/bvnxh5/hotdogs_in_the_instant_pot/,['overkill']
286,7ojt02.jpg,I finally did it and I do not regret it,https://i.redd.it/usl1fbsktg801.jpg,https://www.reddit.com/r/shittyfoodporn/comments/7ojt02/i_finally_did_it_and_i_do_not_regret_it/,['gross']
287,9c2mze.jpg,Bacon wrapped sausages from one of my wife’s Facebook friends,https://i.redd.it/uh6ep9ccdmj11.jpg,https://www.reddit.com/r/shittyfoodporn/comments/9c2mze/bacon_wrapped_sausages_from_one_of_my_wifes/,['bad exe']
288,b1ir5n.jpg,"Sour pickle pie from a local pizza shop. The old lady wanted to try it, was surprising pretty tasty.",https://i.redd.it/ig5ikpsmybm21.jpg,https://www.reddit.com/r/shittyfoodporn/comments/b1ir5n/sour_pickle_pie_from_a_local_pizza_shop_the_old/,['gross']
289,64xlvd.jpg,We want MORE burgers!,https://i.redd.it/x3bbap4904ry.jpg,https://www.reddit.com/r/shittyfoodporn/comments/64xlvd/we_want_more_burgers/,['overkill']
290,b25hpn.jpg,I used food dye to make my scrambled eggs green in celebration of St. Patrick’s Day. Didn’t think it would make it look this unappetizing.,https://i.redd.it/z2bkhoz6som21.jpg,https://www.reddit.com/r/shittyfoodporn/comments/b25hpn/i_used_food_dye_to_make_my_scrambled_eggs_green/,['bad exe']
291,d1bbzx.jpg,Asked for breadsticks while my friends were working back in high school.,https://i.redd.it/hmxymc7tndl31.jpg,https://www.reddit.com/r/shittyfoodporn/comments/d1bbzx/asked_for_breadsticks_while_my_friends_were/,['bad exe']
292,9g798l.jpg,Chewing gum and bananas.,https://i.redd.it/r0hq5md3jim11.jpg,https://www.reddit.com/r/shittyfoodporn/comments/9g798l/chewing_gum_and_bananas/,['gross']
293,dkdu0v.jpg,"Made rice crispy treats out of strawberry rice crispys, and they look like hamburger meat",https://i.imgur.com/C9qBlwv.jpg,https://www.reddit.com/r/shittyfoodporn/comments/dkdu0v/made_rice_crispy_treats_out_of_strawberry_rice/,['bad exe']
294,bgtff7.jpg,Apparently my romantic stoner leftover snacktray belongs here,https://i.redd.it/w9zmr0t767u21.jpg,https://www.reddit.com/r/shittyfoodporn/comments/bgtff7/apparently_my_romantic_stoner_leftover_snacktray/,['poor man']
295,b0ppdj.jpg,Spaghetti and meatballs,https://i.redd.it/zq448f0enxl21.jpg,https://www.reddit.com/r/shittyfoodporn/comments/b0ppdj/spaghetti_and_meatballs/,['gross']
296,bh24zd.jpg,The sandwich they served on my 10 hour flight.,https://i.redd.it/n3owy0461bu21.jpg,https://www.reddit.com/r/shittyfoodporn/comments/bh24zd/the_sandwich_they_served_on_my_10_hour_flight/,['bad exe']
297,8vlki6.jpg,Sometimes I just eat a whole package of imitation crab meat drowned in butter.,https://i.imgur.com/dXpmQCW.jpg,https://www.reddit.com/r/shittyfoodporn/comments/8vlki6/sometimes_i_just_eat_a_whole_package_of_imitation/,['overkill']
298,84xl6y.jpg,School decided to mix applesauce and Jell-O for St. Patrick's day,https://i.imgur.com/vNAgLdc.jpg,https://www.reddit.com/r/shittyfoodporn/comments/84xl6y/school_decided_to_mix_applesauce_and_jello_for_st/,['bad exe']
299,dbcf26.jpg,TIL: you can make scrambled pancakes,https://i.redd.it/fudo5e9csqp31.jpg,https://www.reddit.com/r/shittyfoodporn/comments/dbcf26/til_you_can_make_scrambled_pancakes/,['bad exe']
300,c68byz.jpg,"Froot Loops in Oatmeal was a favorite when I was a kid, but 40+ years later, I tried it again and it was shitty",https://i.redd.it/ah32r54eox631.jpg,https://www.reddit.com/r/shittyfoodporn/comments/c68byz/froot_loops_in_oatmeal_was_a_favorite_when_i_was/,['gross']
301,chiimu.jpg,"Pizza Rolls, Tots, and sausage links. What I like to call the freezer sampler",https://i.redd.it/ir4fdzoifdc31.jpg,https://www.reddit.com/r/shittyfoodporn/comments/chiimu/pizza_rolls_tots_and_sausage_links_what_i_like_to/,['poor man']
302,94jpd4.jpg,Pickle dog,https://i.redd.it/nlkzznwwb3e11.jpg,https://www.reddit.com/r/shittyfoodporn/comments/94jpd4/pickle_dog/,['gross']
303,blax3m.jpg,Peeled nuggets (found on Twitter),https://i.redd.it/csqb0x1xskw21.jpg,https://www.reddit.com/r/shittyfoodporn/comments/blax3m/peeled_nuggets_found_on_twitter/,['gross']
304,dpnan5.jpg,Smokers' lungs steak,https://i.redd.it/gmd4vtzjlvv31.jpg,https://www.reddit.com/r/shittyfoodporn/comments/dpnan5/smokers_lungs_steak/,['gross']
305,5965i8.jpg,My delicious salad from a Domino's pizza in Sarasota (refund denied),http://i.imgur.com/Km3xTTU.jpg,https://www.reddit.com/r/shittyfoodporn/comments/5965i8/my_delicious_salad_from_a_dominos_pizza_in/,['bad exe']
306,9gj5xp.jpg,Oreos and salsa,https://i.imgur.com/lpgo9Cz.jpg,https://www.reddit.com/r/shittyfoodporn/comments/9gj5xp/oreos_and_salsa/,['gross']
307,8xb5x6.jpg,"Giant burger I made with lettuce, cheese and two microwave pizzas.",https://i.redd.it/pva69v3p2x811.jpg,https://www.reddit.com/r/shittyfoodporn/comments/8xb5x6/giant_burger_i_made_with_lettuce_cheese_and_two/,['overkill']
308,bcxmsr.jpg,“Let’s use a piping bag to distribute the beans more evenly on the nachos”,https://i.redd.it/lz7wavamr4s21.jpg,https://www.reddit.com/r/shittyfoodporn/comments/bcxmsr/lets_use_a_piping_bag_to_distribute_the_beans/,['bad exe']
309,bzm7cx.jpg,Foodporn banned me for this :(,https://i.redd.it/st4cm0qsiu331.jpg,https://www.reddit.com/r/shittyfoodporn/comments/bzm7cx/foodporn_banned_me_for_this/,['odd']
310,dhcplu.jpg,Croc pot.,https://i.redd.it/vib2tl8g67s31.jpg,https://www.reddit.com/r/shittyfoodporn/comments/dhcplu/croc_pot/,['gross']
311,8yybw0.jpg,I was just served this dish in Seattle. Hipster food has gone full circle.,https://i.redd.it/4yyq4svvp0a11.jpg,https://www.reddit.com/r/shittyfoodporn/comments/8yybw0/i_was_just_served_this_dish_in_seattle_hipster/,['gross']
312,dcoj7q.jpg,Eggcellent Smithers,https://i.redd.it/5dfhs72zpaq31.jpg,https://www.reddit.com/r/shittyfoodporn/comments/dcoj7q/eggcellent_smithers/,['good exe']
313,87juit.png,Mozz-erize me.,https://i.imgur.com/tjA4uKt.png,https://www.reddit.com/r/shittyfoodporn/comments/87juit/mozzerize_me/,['bad exe']
314,7ceqzx.png,"This curly fries construction, with melted cheese product to hold it together",https://i.redd.it/8ik2xclfvixz.png,https://www.reddit.com/r/shittyfoodporn/comments/7ceqzx/this_curly_fries_construction_with_melted_cheese/,['overkill']
315,ayca98.jpg,Corn turds (not OC/OP),https://i.imgur.com/V7kF0hk.jpg,https://www.reddit.com/r/shittyfoodporn/comments/ayca98/corn_turds_not_ocop/,['bad exe']
316,d0vqwf.jpg,I tried to make sausage stuffed crust pizza (sorry for low quality),https://i.redd.it/9yhuwkuy76l31.jpg,https://www.reddit.com/r/shittyfoodporn/comments/d0vqwf/i_tried_to_make_sausage_stuffed_crust_pizza_sorry/,['bad exe']
317,d96jlj.jpg,"Mid-day depression meal. Triple fudge brownie ice cream with a side of leftover spaghetti. Side note, I'm not suppose to have dairy.",https://i.redd.it/hubaau42zro31.jpg,https://www.reddit.com/r/shittyfoodporn/comments/d96jlj/midday_depression_meal_triple_fudge_brownie_ice/,['gross']
318,5r84wi.jpg,When kfc is lazy,https://i.redd.it/ldvwpfgms1dy.jpg,https://www.reddit.com/r/shittyfoodporn/comments/5r84wi/when_kfc_is_lazy/,['bad exe']
319,bxfs7l.jpg,Pizza Crust Pizza,https://i.imgur.com/lf5wTfX.jpg,https://www.reddit.com/r/shittyfoodporn/comments/bxfs7l/pizza_crust_pizza/,['odd']
320,axvxo2.jpg,Cursed Pancakes,https://i.redd.it/mdma32ke5gk21.jpg,https://www.reddit.com/r/shittyfoodporn/comments/axvxo2/cursed_pancakes/,['bad exe']
321,8pegot.jpg,It tasted like you put salt in flat Pepsi,https://i.redd.it/2el8z0x5jn211.jpg,https://www.reddit.com/r/shittyfoodporn/comments/8pegot/it_tasted_like_you_put_salt_in_flat_pepsi/,['gross']
322,c25nrr.jpg,"Wanted to make tea eggs, but ended up making plague eggs.",https://i.redd.it/8i0zt8w5o5531.jpg,https://www.reddit.com/r/shittyfoodporn/comments/c25nrr/wanted_to_make_tea_eggs_but_ended_up_making/,['bad exe']
323,cedmjg.jpg,Found this useful life hack on Instagram,https://i.redd.it/nuz724zvjva31.jpg,https://www.reddit.com/r/shittyfoodporn/comments/cedmjg/found_this_useful_life_hack_on_instagram/,['gross']
324,6wt0sm.jpg,Good Christ,http://i.imgur.com/J7HRbjX.jpg,https://www.reddit.com/r/shittyfoodporn/comments/6wt0sm/good_christ/,['good exe']
325,7k345g.jpg,My mom's Christmas cookies didn't come out like she'd anticipated...,https://i.redd.it/gye1yl69w5401.jpg,https://www.reddit.com/r/shittyfoodporn/comments/7k345g/my_moms_christmas_cookies_didnt_come_out_like/,['bad exe']
326,bcpj1p.jpg,The truth.,https://i.redd.it/6kv3m9nfn0s21.jpg,https://www.reddit.com/r/shittyfoodporn/comments/bcpj1p/the_truth/,['odd']
327,c0vnlu.jpg,Did I forget to remove plastic wrapper?,https://i.redd.it/7c254jzmrh431.jpg,https://www.reddit.com/r/shittyfoodporn/comments/c0vnlu/did_i_forget_to_remove_plastic_wrapper/,['bad exe']
328,ar47cx.jpg,Strawberry brownies look like salmon,https://i.redd.it/rnj6y869bug21.jpg,https://www.reddit.com/r/shittyfoodporn/comments/ar47cx/strawberry_brownies_look_like_salmon/,['bad exe']
329,c5znak.jpg,Found on Facebook,https://i.redd.it/p92fs0tu5t631.jpg,https://www.reddit.com/r/shittyfoodporn/comments/c5znak/found_on_facebook/,['gross']
330,74ok7v.jpg,"My coworker brought ingredients for ""raw meat sandwiches""",https://i.imgur.com/rw6pYSE.jpg,https://www.reddit.com/r/shittyfoodporn/comments/74ok7v/my_coworker_brought_ingredients_for_raw_meat/,['gross']
331,be6vk2.jpg,Vacuum packed baked beans,https://i.redd.it/9chx7t6xcts21.jpg,https://www.reddit.com/r/shittyfoodporn/comments/be6vk2/vacuum_packed_baked_beans/,['gross']
332,cy92je.jpg,"My nan just casually made this monstrosity and ate it no issues. Butter, strawberries and cold meat...",https://i.redd.it/6w5ydw6x1zj31.jpg,https://www.reddit.com/r/shittyfoodporn/comments/cy92je/my_nan_just_casually_made_this_monstrosity_and/,['gross']
333,bnbkzi.jpg,Check out my new setup,https://i.redd.it/rocuqkijtkx21.jpg,https://www.reddit.com/r/shittyfoodporn/comments/bnbkzi/check_out_my_new_setup/,['poor man']
334,azffrf.jpg,A nice hotdog with extra ketchupwater to stay hydrated after i forgot to shake the bottle,https://i.redd.it/60a1g2yeial21.jpg,https://www.reddit.com/r/shittyfoodporn/comments/azffrf/a_nice_hotdog_with_extra_ketchupwater_to_stay/,['gross']
335,dng4y0.jpg,Glorious,https://i.redd.it/8j9gkab0xwu31.jpg,https://www.reddit.com/r/shittyfoodporn/comments/dng4y0/glorious/,['good exe']
336,60hxxv.jpg,Papa Johns pizza slicing is next to none,https://i.redd.it/v0jqfs65nlmy.jpg,https://www.reddit.com/r/shittyfoodporn/comments/60hxxv/papa_johns_pizza_slicing_is_next_to_none/,['odd']
337,559jwe.jpg,Lunchables for the discerning young professional.,http://i.imgur.com/MURVZfh.jpg,https://www.reddit.com/r/shittyfoodporn/comments/559jwe/lunchables_for_the_discerning_young_professional/,['poor man']
338,bt8wgl.jpg,Hotdog Hotdog,https://i.redd.it/y64jl37wlk031.jpg,https://www.reddit.com/r/shittyfoodporn/comments/bt8wgl/hotdog_hotdog/,['overkill']
339,g1sn5j.jpg,"The perfect pair: mac and cheese with flamin hot limon Cheetos, microwaved",https://i.redd.it/4ve4nzoxozs41.jpg,https://www.reddit.com/r/shittyfoodporn/comments/g1sn5j/the_perfect_pair_mac_and_cheese_with_flamin_hot/,['overkill']
340,csv5b5.jpg,"Roommate said he ordered ""the good stuff""",https://i.redd.it/qlfqlj54hkh31.jpg,https://www.reddit.com/r/shittyfoodporn/comments/csv5b5/roommate_said_he_ordered_the_good_stuff/,['overkill']
341,bx7ejz.jpg,Bento box - Japan,https://i.redd.it/48sins84kl231.jpg,https://www.reddit.com/r/shittyfoodporn/comments/bx7ejz/bento_box_japan/,['good exe']
342,8yrtiz.jpg,"Well, it shouldn’t be",https://i.redd.it/gxu2zfxihv911.jpg,https://www.reddit.com/r/shittyfoodporn/comments/8yrtiz/well_it_shouldnt_be/,['gross']
343,9g08j5.jpg,"American Airlines, going all out with breakfast in first class",https://i.redd.it/k5tda1xzfdm11.jpg,https://www.reddit.com/r/shittyfoodporn/comments/9g08j5/american_airlines_going_all_out_with_breakfast_in/,['bad exe']
344,doeglt.jpg,"My boyfriend is in the USMC. Currently in the field having a ""taco"" MRE. Bless his heart.",https://i.redd.it/2lwwmm4j9cv31.jpg,https://www.reddit.com/r/shittyfoodporn/comments/doeglt/my_boyfriend_is_in_the_usmc_currently_in_the/,['bad exe']
345,8j4xq2.jpg,Unidentifiable from facebook,https://i.redd.it/ekc9qnnwfnx01.jpg,https://www.reddit.com/r/shittyfoodporn/comments/8j4xq2/unidentifiable_from_facebook/,['gross']
346,bfe7jc.jpg,McNugget Sliders,https://i.redd.it/sr2g7chd7gt21.jpg,https://www.reddit.com/r/shittyfoodporn/comments/bfe7jc/mcnugget_sliders/,['good exe']
347,bqb8kl.jpg,My daughter”s collection of questionable beverages,https://i.redd.it/pdxuk5poi2z21.jpg,https://www.reddit.com/r/shittyfoodporn/comments/bqb8kl/my_daughters_collection_of_questionable_beverages/,['gross']
348,babg6g.jpg,marinara Mac and cheese,https://i.redd.it/wr5blwh1yqq21.jpg,https://www.reddit.com/r/shittyfoodporn/comments/babg6g/marinara_mac_and_cheese/,['gross']
349,bfpl2j.jpg,90's ketchup. It looks like paint.,https://i.redd.it/3o0bb1nurmt21.jpg,https://www.reddit.com/r/shittyfoodporn/comments/bfpl2j/90s_ketchup_it_looks_like_paint/,['gross']
350,73f9an.jpg,Milk Steak with Jelly Beans,https://i.redd.it/7ttjgh0g81pz.jpg,https://www.reddit.com/r/shittyfoodporn/comments/73f9an/milk_steak_with_jelly_beans/,['gross']
351,bahxef.jpg,Fancified frozen burritos,https://i.redd.it/8x0odcapavq21.jpg,https://www.reddit.com/r/shittyfoodporn/comments/bahxef/fancified_frozen_burritos/,['good exe']
352,bvfjzn.jpg,"""Pulled Pork Parfait"" - pulled pork, instant mashed potatoes, bbq sauce, shredded cheese out of the bag.",https://i.redd.it/gicp9tjgen131.jpg,https://www.reddit.com/r/shittyfoodporn/comments/bvfjzn/pulled_pork_parfait_pulled_pork_instant_mashed/,['good exe']
353,b4w5c3.jpg,"Leftover Arby’s fries, pre-cooked bacon, and eggs.",https://i.redd.it/vhf9r3svf2o21.jpg,https://www.reddit.com/r/shittyfoodporn/comments/b4w5c3/leftover_arbys_fries_precooked_bacon_and_eggs/,['poor man']
354,b05ygq.jpg,Grilled cheese made with a waffle maker,https://i.redd.it/f9dx9bk0vnl21.jpg,https://www.reddit.com/r/shittyfoodporn/comments/b05ygq/grilled_cheese_made_with_a_waffle_maker/,['bad exe']
355,cmb3c3.jpg,"A “Dooley”. Uncut pizza wrapped around garlic bread, and eaten like a burrito. You’re welcome.",https://i.redd.it/301o51iovme31.jpg,https://www.reddit.com/r/shittyfoodporn/comments/cmb3c3/a_dooley_uncut_pizza_wrapped_around_garlic_bread/,['overkill']
356,d00apc.jpg,Japanese sandwiches,https://i.imgur.com/5hLqTGq.jpg,https://www.reddit.com/r/shittyfoodporn/comments/d00apc/japanese_sandwiches/,['gross']
357,cvqvl1.jpg,I airfried an entire hotdog lol,https://i.redd.it/rtdh1synrti31.jpg,https://www.reddit.com/r/shittyfoodporn/comments/cvqvl1/i_airfried_an_entire_hotdog_lol/,['gross']
358,82om76.jpg,Friend ordered the Cheese &amp; Crackers appetizer. I guess they got exactly that.,https://i.redd.it/2gaqit8mock01.jpg,https://www.reddit.com/r/shittyfoodporn/comments/82om76/friend_ordered_the_cheese_crackers_appetizer_i/,['bad exe']
359,cox5r1.jpg,"Found this on r/pics, thought it belonged here.",https://i.redd.it/bkfkrno0jsf31.jpg,https://www.reddit.com/r/shittyfoodporn/comments/cox5r1/found_this_on_rpics_thought_it_belonged_here/,['overkill']
360,bwcalo.jpg,Cheesesteak Cheesecake,https://i.redd.it/dnvx1g90z5231.jpg,https://www.reddit.com/r/shittyfoodporn/comments/bwcalo/cheesesteak_cheesecake/,['gross']
361,ccpa3f.jpg,Smores poptart pancake for pregnant wife,https://imgur.com/6n9tW2U.jpg,https://www.reddit.com/r/shittyfoodporn/comments/ccpa3f/smores_poptart_pancake_for_pregnant_wife/,['overkill']
362,7xi1e3.jpg,Romance is alive. Happy Valentine’s Day from Publix.,https://i.redd.it/ezbspl55m6g01.jpg,https://www.reddit.com/r/shittyfoodporn/comments/7xi1e3/romance_is_alive_happy_valentines_day_from_publix/,['odd']
363,67qjko.jpg,Liquorice sandwich (crosspost from funny),https://i.redd.it/rkqe6rdv7vty.jpg,https://www.reddit.com/r/shittyfoodporn/comments/67qjko/liquorice_sandwich_crosspost_from_funny/,['gross']
364,doxmze.jpg,im never deleting facebook,https://i.redd.it/lrtnw40t5kv31.jpg,https://www.reddit.com/r/shittyfoodporn/comments/doxmze/im_never_deleting_facebook/,['gross']
365,arjsrl.jpg,my buddy wanted a gluten free hotdog,https://i.redd.it/b43wb70i74h21.jpg,https://www.reddit.com/r/shittyfoodporn/comments/arjsrl/my_buddy_wanted_a_gluten_free_hotdog/,['poor man']
366,awtvlh.jpg,My breakfast.,https://i.redd.it/ptd5ea4klwj21.jpg,https://www.reddit.com/r/shittyfoodporn/comments/awtvlh/my_breakfast/,['bad exe']
367,7tx0kg.jpg,Girlfriend made a chicken pot pie,https://i.redd.it/gdykrl9xn3d01.jpg,https://www.reddit.com/r/shittyfoodporn/comments/7tx0kg/girlfriend_made_a_chicken_pot_pie/,['good exe']
368,cdwrl6.jpg,"My professor calling out my university's meal hall on their excuse for ""food"".",https://i.redd.it/qir991i1zna31.jpg,https://www.reddit.com/r/shittyfoodporn/comments/cdwrl6/my_professor_calling_out_my_universitys_meal_hall/,['bad exe']
369,50yjq4.jpg,This rice ♥ with the couple's initials.,https://i.imgur.com/L5otod7.jpg,https://www.reddit.com/r/shittyfoodporn/comments/50yjq4/this_rice_with_the_couples_initials/,['odd']
370,cz4lyy.jpg,I present to you ham pizza toast- the breakfast of stoners.,https://i.redd.it/s2oj29vyndk31.jpg,https://www.reddit.com/r/shittyfoodporn/comments/cz4lyy/i_present_to_you_ham_pizza_toast_the_breakfast_of/,['poor man']
371,d6u7vg.jpg,My favorite food truck food,https://i.redd.it/hsbicsc9tqn31.jpg,https://www.reddit.com/r/shittyfoodporn/comments/d6u7vg/my_favorite_food_truck_food/,['gross']
372,d2om14.jpg,My first attempt at making macarons,https://i.redd.it/0ik3eooy9yl31.jpg,https://www.reddit.com/r/shittyfoodporn/comments/d2om14/my_first_attempt_at_making_macarons/,['bad exe']
373,9hndb3.jpg,Grits and Cheese from a U.S. Naval Galley,https://i.imgur.com/RyymaGx.jpg,https://www.reddit.com/r/shittyfoodporn/comments/9hndb3/grits_and_cheese_from_a_us_naval_galley/,['bad exe']
374,dit8wp.jpg,Once every few years I get excited for the McRib...and then I am quickly brought back to reality.,https://i.redd.it/7xo5ouvo1ys31.jpg,https://www.reddit.com/r/shittyfoodporn/comments/dit8wp/once_every_few_years_i_get_excited_for_the/,['bad exe']
375,861ab8.jpg,"Homemade dumplings gone horribly, horribly wrong.",https://i.redd.it/bh6f51tto3n01.jpg,https://www.reddit.com/r/shittyfoodporn/comments/861ab8/homemade_dumplings_gone_horribly_horribly_wrong/,['bad exe']
376,9937ky.jpg,Would anybody care for some watermelon?,https://i.imgur.com/s35WNcN.jpg,https://www.reddit.com/r/shittyfoodporn/comments/9937ky/would_anybody_care_for_some_watermelon/,['bad exe']
377,d75tyx.jpg,My roommate was really high playing Borderlands 3 and forgot he was boiling eggs.,https://i.redd.it/5x4xyrotgvn31.jpg,https://www.reddit.com/r/shittyfoodporn/comments/d75tyx/my_roommate_was_really_high_playing_borderlands_3/,['burnt']
378,au0c45.jpg,Just.. why ?,https://i.redd.it/rv73pi3jydi21.jpg,https://www.reddit.com/r/shittyfoodporn/comments/au0c45/just_why/,['good exe']
