,path,title,img_url,full_link,label
0,bjygyd.jpg,Crab Boiled In Pepsi Max for 2 Hours Served In a Baguette. (Sorry for good Quality),https://i.redd.it/v0c8ym4ieuv21.jpg,https://www.reddit.com/r/shittyfoodporn/comments/bjygyd/crab_boiled_in_pepsi_max_for_2_hours_served_in_a/,['gross']
1,870mch.jpg,Illegal image,https://i.imgur.com/D6L8JZU.jpg,https://www.reddit.com/r/shittyfoodporn/comments/870mch/illegal_image/,['gross']
2,988cgu.jpg,I found a single ear of wheat growing in my garden so I milled it into flour and made a tiny loaf of bread,https://i.redd.it/p7x24ibskrg11.jpg,https://www.reddit.com/r/shittyfoodporn/comments/988cgu/i_found_a_single_ear_of_wheat_growing_in_my/,['good exe']
3,8intue.jpg,Do you guys eat the burger with or without the peel?,https://i.redd.it/m2tqxuazc8x01.jpg,https://www.reddit.com/r/shittyfoodporn/comments/8intue/do_you_guys_eat_the_burger_with_or_without_the/,['gross']
4,7hzukw.jpg,Nailed it,https://i.redd.it/1dlxd5hndc201.jpg,https://www.reddit.com/r/shittyfoodporn/comments/7hzukw/nailed_it/,['bad exe']
5,8wk3z1.jpg,"Homemade 'Bloody Mary'. Had no tomato juice, so used ketchup, had no celery, so used a spring onion. Bone apple teeth.",https://i.redd.it/vdv0fs1tyb811.jpg,https://www.reddit.com/r/shittyfoodporn/comments/8wk3z1/homemade_bloody_mary_had_no_tomato_juice_so_used/,['gross']
6,82f91v.jpg,Chinese takeout,https://i.imgur.com/iqMfgnG.jpg,https://www.reddit.com/r/shittyfoodporn/comments/82f91v/chinese_takeout/,['bad execution']
7,7qta7o.jpg,I found a whole case in the frozen section at Walmart dedicated to this subreddit,https://i.redd.it/yqnj1vq4ega01.jpg,https://www.reddit.com/r/shittyfoodporn/comments/7qta7o/i_found_a_whole_case_in_the_frozen_section_at/,['overkill']
8,8olfjv.jpg,i’m fairly certain i’ll never be invited to a potluck again.,https://i.redd.it/8oq0nvq952211.jpg,https://www.reddit.com/r/shittyfoodporn/comments/8olfjv/im_fairly_certain_ill_never_be_invited_to_a/,['good execution']
9,b651un.jpg,Fixed it,https://i.redd.it/v08c5c6k7oo21.jpg,https://www.reddit.com/r/shittyfoodporn/comments/b651un/fixed_it/,['odd']
10,71l5ts.png,What a time to be alive,https://i.imgur.com/2S9v37n.png,https://www.reddit.com/r/shittyfoodporn/comments/71l5ts/what_a_time_to_be_alive/,['overkill']
11,941w11.jpg,Shitty Porn Food,https://i.redd.it/7bqxlrg68ga11.jpg,https://www.reddit.com/r/shittyfoodporn/comments/941w11/shitty_porn_food/,['bad execution']
12,848005.jpg,Your aunt’s fav dish,https://i.redd.it/g571hpdupll01.jpg,https://www.reddit.com/r/shittyfoodporn/comments/848005/your_aunts_fav_dish/,['good execution']
13,9a7h8g.jpg,Krave is basically just cat treats for humans.,https://i.redd.it/twzok746a9i11.jpg,https://www.reddit.com/r/shittyfoodporn/comments/9a7h8g/krave_is_basically_just_cat_treats_for_humans/,['gross']
14,8rey3c.jpg,"So my friend ordered a pizza, got this",https://i.redd.it/420e49bjq8411.jpg,https://www.reddit.com/r/shittyfoodporn/comments/8rey3c/so_my_friend_ordered_a_pizza_got_this/,['gross']
15,673i7u.jpg,"Gordon Ramsay with absolutely no chill roasting a ""flooded"" burger",https://i.redd.it/pvpeqw4f9cty.jpg,https://www.reddit.com/r/shittyfoodporn/comments/673i7u/gordon_ramsay_with_absolutely_no_chill_roasting_a/,['gross']
16,88tjol.jpg,"These ""treats"" my mom made for easter/april fools",https://i.redd.it/5j7pbttrrcp01.jpg,https://www.reddit.com/r/shittyfoodporn/comments/88tjol/these_treats_my_mom_made_for_easterapril_fools/,['good exe']
17,6jwsnp.jpg,Typical lunch for the least healthy man in the world. The guy works with me.,https://i.redd.it/ylfey4g00a6z.jpg,https://www.reddit.com/r/shittyfoodporn/comments/6jwsnp/typical_lunch_for_the_least_healthy_man_in_the/,['overkill']
18,5pzc6m.jpg,Wife can't eat cheese so here's her stupid looking pizza.,http://i.imgur.com/Cy0Klsg.jpg,https://www.reddit.com/r/shittyfoodporn/comments/5pzc6m/wife_cant_eat_cheese_so_heres_her_stupid_looking/,['good exe']
19,h11754.jpg,2 Michelin Star restaurant had this on Instagram,https://i.redd.it/fyrde3i7sa451.jpg,https://www.reddit.com/r/shittyfoodporn/comments/h11754/2_michelin_star_restaurant_had_this_on_instagram/,['bad exe']
20,chsodl.png,DIY soy milk,https://i.redd.it/byfifvl29ic31.png,https://www.reddit.com/r/shittyfoodporn/comments/chsodl/diy_soy_milk/,['gross']
21,ax98uy.jpg,Wife doesn’t trust me with our Tupperware anymore. Spaghetti lunch in ziploc.,https://i.redd.it/07kg8ss7t4k21.jpg,https://www.reddit.com/r/shittyfoodporn/comments/ax98uy/wife_doesnt_trust_me_with_our_tupperware_anymore/,['bad exe']
22,drm4mx.png,Cheese sticks,https://i.redd.it/c70c2kxaupw31.png,https://www.reddit.com/r/shittyfoodporn/comments/drm4mx/cheese_sticks/,['gross']
23,8kggoo.jpg,The most unevenly cooked steak in Texas Roadhouse history,https://i.imgur.com/XLaYJLz.jpg,https://www.reddit.com/r/shittyfoodporn/comments/8kggoo/the_most_unevenly_cooked_steak_in_texas_roadhouse/,['bad execution']
24,98my1p.jpg,Sweet Sue's Chicken,https://i.redd.it/kl1mpo7is3h11.jpg,https://www.reddit.com/r/shittyfoodporn/comments/98my1p/sweet_sues_chicken/,['gross']
25,7hhqft.jpg,This is the worst fucking sandwich ive ever seen.,https://i.redd.it/iub23j494x101.jpg,https://www.reddit.com/r/shittyfoodporn/comments/7hhqft/this_is_the_worst_fucking_sandwich_ive_ever_seen/,['bad exe']
26,8mjouy.jpg,"Man, the 70s were fuckin wild...",https://i.imgur.com/G2sRc7e.jpg,https://www.reddit.com/r/shittyfoodporn/comments/8mjouy/man_the_70s_were_fuckin_wild/,['good exe']
27,bnu7l7.jpg,Am I the only one that thinks burgers like this are shitty? To me the entire point of a burger is you can eat it like a sandwich..,https://i.redd.it/yhldr1hhiux21.jpg,https://www.reddit.com/r/shittyfoodporn/comments/bnu7l7/am_i_the_only_one_that_thinks_burgers_like_this/,['overkill']
28,bawyu8.jpg,WHY IS IT GRAY??,https://i.redd.it/u5vnwik9arl21.jpg,https://www.reddit.com/r/shittyfoodporn/comments/bawyu8/why_is_it_gray/,['gross']
29,7tidr7.jpg,My school lunch. Paid $3.25 for this.,https://i.redd.it/ar62wc4htqc01.jpg,https://www.reddit.com/r/shittyfoodporn/comments/7tidr7/my_school_lunch_paid_325_for_this/,['bad exe']
30,6v4kes.jpg,Chicken nuggets and tater tots slow roasted in my oven for 8 hours while I'm passed out drunk in the other room.,https://i.redd.it/yion820zn4hz.jpg,https://www.reddit.com/r/shittyfoodporn/comments/6v4kes/chicken_nuggets_and_tater_tots_slow_roasted_in_my/,['burnt']
31,8elmv5.jpg,First attempt making French bread. Looks like a gaping asshole.,https://i.redd.it/i9tyzf4tsvt01.jpg,https://www.reddit.com/r/shittyfoodporn/comments/8elmv5/first_attempt_making_french_bread_looks_like_a/,['bad exe']
32,83nhkf.jpg,G-Eazy’s Garlic Fries,https://i.redd.it/c89wha8so5l01.jpg,https://www.reddit.com/r/shittyfoodporn/comments/83nhkf/geazys_garlic_fries/,['bad exe']
33,htstrk.jpg,Wife asked for a snack didn’t say which so I made a charcuterie board. Idk what that is tho,https://i.redd.it/ay64zak93qb51.jpg,https://www.reddit.com/r/shittyfoodporn/comments/htstrk/wife_asked_for_a_snack_didnt_say_which_so_i_made/,['poor man']
34,6pg4zn.png,A person near my house is redoing Burger King advertising pictures,http://i.imgur.com/qzffeF8.png,https://www.reddit.com/r/shittyfoodporn/comments/6pg4zn/a_person_near_my_house_is_redoing_burger_king/,['good exe']
35,8i6zlt.jpg,"The ""World Famous"" Chicken and Waffled I ordered",https://i.redd.it/rv1lv7nxouw01.jpg,https://www.reddit.com/r/shittyfoodporn/comments/8i6zlt/the_world_famous_chicken_and_waffled_i_ordered/,['bad exe']
36,8wbf15.jpg,This was posted to foodporn,https://i.redd.it/vbsj3xzji0811.jpg,https://www.reddit.com/r/shittyfoodporn/comments/8wbf15/this_was_posted_to_foodporn/,['bad exe']
37,63nkh7.jpg,"My university's breakfast food includes the unique ""bacon, egg, and cheese between two cherry Pop-tarts""",https://i.redd.it/hkvoio9o6spy.jpg,https://www.reddit.com/r/shittyfoodporn/comments/63nkh7/my_universitys_breakfast_food_includes_the_unique/,['gross']
38,9585ou.jpg,my boyfriend ate an edible and made this for me,https://i.redd.it/hg442yl8dle11.jpg,https://www.reddit.com/r/shittyfoodporn/comments/9585ou/my_boyfriend_ate_an_edible_and_made_this_for_me/,['bad exe']
39,dk3and.png,This elegant yet understated bracelet my daughter made out of spaghetti and a black olive,https://i.redd.it/u2n2yot5uht31.png,https://www.reddit.com/r/shittyfoodporn/comments/dk3and/this_elegant_yet_understated_bracelet_my_daughter/,['odd']
40,c0kwu4.jpg,My brother did this,https://i.redd.it/nhdcyo5v3c431.jpg,https://www.reddit.com/r/shittyfoodporn/comments/c0kwu4/my_brother_did_this/,['bad exe']
41,8tx09j.jpg,Hi I’m 25 but I eat like I’m 9. Dino-nuggies 4 life,https://i.redd.it/uyi8a57rs9611.jpg,https://www.reddit.com/r/shittyfoodporn/comments/8tx09j/hi_im_25_but_i_eat_like_im_9_dinonuggies_4_life/,['good exe']
42,6b4ayx.png,Free range corndogs.,https://i.redd.it/h7q0bej7dhxy.png,https://www.reddit.com/r/shittyfoodporn/comments/6b4ayx/free_range_corndogs/,['gross']
43,9capsc.jpg,Kuwaiti police have shut down a fish store that was sticking googly eyes on fish to make them appear more fresh than they are. :-),https://i.imgur.com/lBWQLM6.jpg,https://www.reddit.com/r/shittyfoodporn/comments/9capsc/kuwaiti_police_have_shut_down_a_fish_store_that/,['gross']
44,biutr6.jpg,"I noticed that hash browns and a slice of Spam are about the same size, so I made this masterpiece.",https://i.redd.it/bplqaho7r9v21.jpg,https://www.reddit.com/r/shittyfoodporn/comments/biutr6/i_noticed_that_hash_browns_and_a_slice_of_spam/,['gross']
45,b9dt44.jpg,"This came to me in a dream, I had to make it real",https://i.redd.it/31yng5s7i9q21.jpg,https://www.reddit.com/r/shittyfoodporn/comments/b9dt44/this_came_to_me_in_a_dream_i_had_to_make_it_real/,['gross']
46,axk85z.jpg,My sister ordered take out...I guess this was their only empty box for transporting.,https://i.redd.it/acdicar3fak21.jpg,https://www.reddit.com/r/shittyfoodporn/comments/axk85z/my_sister_ordered_take_outi_guess_this_was_their/,['gross']
47,896am9.jpg,It’s one of those days...,https://i.redd.it/qo8ghb986kp01.jpg,https://www.reddit.com/r/shittyfoodporn/comments/896am9/its_one_of_those_days/,['poor man']
48,6a5jyd.png,"The ""stoner pie"" from a local pizza place. Extra meat and cheese with French fries and mozzerella sticks",https://i.redd.it/ys8a8yradhwy.png,https://www.reddit.com/r/shittyfoodporn/comments/6a5jyd/the_stoner_pie_from_a_local_pizza_place_extra/,['good exe']
49,5vqr93.jpg,Very Artistic Photo Of Shitty Food,https://i.imgur.com/SP8Qo6H.jpg,https://www.reddit.com/r/shittyfoodporn/comments/5vqr93/very_artistic_photo_of_shitty_food/,['odd']
50,79gj44.jpg,Supermarket thought it was a good idea to make black chicken nuggets for Halloween...,https://i.redd.it/o1sa8a5tvruz.jpg,https://www.reddit.com/r/shittyfoodporn/comments/79gj44/supermarket_thought_it_was_a_good_idea_to_make/,['bad exe']
51,huii66.jpg,Found this at my local pharmacy [OC],https://i.redd.it/ryr4sw94hzb51.jpg,https://www.reddit.com/r/shittyfoodporn/comments/huii66/found_this_at_my_local_pharmacy_oc/,['gross']
52,buubfs.jpg,Egg cake,https://i.redd.it/yqeqbtpu6d131.jpg,https://www.reddit.com/r/shittyfoodporn/comments/buubfs/egg_cake/,['gross']
53,7x9jel.jpg,Genius Marketing,https://i.imgur.com/XNyKadM.jpg,https://www.reddit.com/r/shittyfoodporn/comments/7x9jel/genius_marketing/,['odd']
54,ay370k.jpg,Five Guys grilled cheese. It’s about 5 slices of American cheese with hamburger bun bread. $6.,https://i.redd.it/509qjejf1kk21.jpg,https://www.reddit.com/r/shittyfoodporn/comments/ay370k/five_guys_grilled_cheese_its_about_5_slices_of/,['bad exe']
55,6nwp72.jpg,Eggs Finely Poached In A Latex Glove With Ketchup Nails &amp; Sausage Watch,https://i.redd.it/ppaqv8zmd8az.jpg,https://www.reddit.com/r/shittyfoodporn/comments/6nwp72/eggs_finely_poached_in_a_latex_glove_with_ketchup/,['bad exe']
56,d27gxz.jpg,My roommates cheese toast.,https://i.redd.it/17804qukprl31.jpg,https://www.reddit.com/r/shittyfoodporn/comments/d27gxz/my_roommates_cheese_toast/,['burnt']
57,b9siq6.jpg,Big Mac spring rolls,https://i.redd.it/cst6zb6yqgq21.jpg,https://www.reddit.com/r/shittyfoodporn/comments/b9siq6/big_mac_spring_rolls/,['good exe']
58,c7cxoy.jpg,I call this ”Payday is tomorrow and I’m out of smokes”,https://i.redd.it/z1pcmjbhnh731.jpg,https://www.reddit.com/r/shittyfoodporn/comments/c7cxoy/i_call_this_payday_is_tomorrow_and_im_out_of/,['poor man']
59,6e7b49.jpg,Michell man star worthy,https://i.redd.it/qffjaj572n0z.jpg,https://www.reddit.com/r/shittyfoodporn/comments/6e7b49/michell_man_star_worthy/,['bad exe']
60,7v36c0.jpg,"Poptarts, smuckers, canned frosting",https://i.redd.it/2gf770r573e01.jpg,https://www.reddit.com/r/shittyfoodporn/comments/7v36c0/poptarts_smuckers_canned_frosting/,['good exe']
61,6cy4tz.jpg,Hot dog egg vaginas,https://i.redd.it/k8jy3z3svbzy.jpg,https://www.reddit.com/r/shittyfoodporn/comments/6cy4tz/hot_dog_egg_vaginas/,['good exe']
62,bq2dej.jpg,Coffee from the coffee machine at my uni,https://i.redd.it/vfqwlscgxxy21.jpg,https://www.reddit.com/r/shittyfoodporn/comments/bq2dej/coffee_from_the_coffee_machine_at_my_uni/,['gross']
63,c08exd.jpg,My coworkers lunch today.,https://i.imgur.com/KWbktEO.jpg,https://www.reddit.com/r/shittyfoodporn/comments/c08exd/my_coworkers_lunch_today/,['poor man']
64,8vteci.jpg,My wife said my lunch belongs here. Sardines with hot sauce.,https://i.redd.it/bbmpfhi3br711.jpg,https://www.reddit.com/r/shittyfoodporn/comments/8vteci/my_wife_said_my_lunch_belongs_here_sardines_with/,['poor man']
65,dacnqv.jpg,"Back when my wife was pregnant with our first, she had a craving for ramen noodles prepared with Kraft Mac &amp; Cheese powder. BEHOLD!!!",https://i.redd.it/0a8e4xz98ap31.jpg,https://www.reddit.com/r/shittyfoodporn/comments/dacnqv/back_when_my_wife_was_pregnant_with_our_first_she/,['odd']
66,72j9kb.jpg,My girlfriend made vegetarian hotdogs. I threw them away.,https://i.imgur.com/D4Ayx5g.jpg,https://www.reddit.com/r/shittyfoodporn/comments/72j9kb/my_girlfriend_made_vegetarian_hotdogs_i_threw/,['gross']
67,cxxq7z.jpg,This is a chessecake my wife was cooking and forgot about. I came home 10 hours after she had gone out to a house full of smoke and fished this out of the oven. I’m happy my house wasn’t on fire.,https://i.redd.it/iq9rbkhzetj31.jpg,https://www.reddit.com/r/shittyfoodporn/comments/cxxq7z/this_is_a_chessecake_my_wife_was_cooking_and/,['burnt']
68,61gj0w.jpg,top post of all time on r/vegan,http://i.imgur.com/milsuOo.jpg,https://www.reddit.com/r/shittyfoodporn/comments/61gj0w/top_post_of_all_time_on_rvegan/,['gross']
69,atjion.jpg,Preschooler’s Delight,https://i.redd.it/42rem17ob5i21.jpg,https://www.reddit.com/r/shittyfoodporn/comments/atjion/preschoolers_delight/,['good exe']
70,cb1hmn.jpg,KFC doesn't give a fuq anymore,https://i.redd.it/rpskvwvdea931.jpg,https://www.reddit.com/r/shittyfoodporn/comments/cb1hmn/kfc_doesnt_give_a_fuq_anymore/,['gross']
71,72196i.jpg,Baja blast margarita with mild sauce garnish,https://i.redd.it/6d3du85wgpnz.jpg,https://www.reddit.com/r/shittyfoodporn/comments/72196i/baja_blast_margarita_with_mild_sauce_garnish/,['gross']
72,az6d9k.jpg,My friend's chicken and waffle dinner,https://i.redd.it/o1pqgs3vw4l21.jpg,https://www.reddit.com/r/shittyfoodporn/comments/az6d9k/my_friends_chicken_and_waffle_dinner/,['poor man']
73,90xx0j.jpg,Gotta stay hydrated,https://i.redd.it/3gkzjkjz9ib11.jpg,https://www.reddit.com/r/shittyfoodporn/comments/90xx0j/gotta_stay_hydrated/,['gross']
74,7ldcx0.jpg,The “Barbecue sauce” from my lunch,https://i.redd.it/thcxitnd0d501.jpg,https://www.reddit.com/r/shittyfoodporn/comments/7ldcx0/the_barbecue_sauce_from_my_lunch/,['gross']
75,8atus7.jpg,19 layer tortilla chip abomination from Chili's,https://i.redd.it/xksf11x2nrq01.jpg,https://www.reddit.com/r/shittyfoodporn/comments/8atus7/19_layer_tortilla_chip_abomination_from_chilis/,['overkill']
76,6nn1sn.jpg,"My 3 year old wanted hotdogs, broccoli and tomatoes. My wife made him this.",https://i.redd.it/lwhzbberdz9z.jpg,https://www.reddit.com/r/shittyfoodporn/comments/6nn1sn/my_3_year_old_wanted_hotdogs_broccoli_and/,['good exe']
77,irg0c6.jpg,This cost $10. Never going there again.,https://i.redd.it/ryzt2mwdxqm51.jpg,https://www.reddit.com/r/shittyfoodporn/comments/irg0c6/this_cost_10_never_going_there_again/,['bad exe']
78,5frcxw.jpg,Power been out for 4 days,https://i.redd.it/9w41rbumzs0y.jpg,https://www.reddit.com/r/shittyfoodporn/comments/5frcxw/power_been_out_for_4_days/,['poor man']
79,8x2h9b.jpg,Forbidden image,https://i.redd.it/uvnr9gqf0r811.jpg,https://www.reddit.com/r/shittyfoodporn/comments/8x2h9b/forbidden_image/,['gross']
80,8qirw4.jpg,"Mods are gone, Upvote real food porn.",https://i.redd.it/sogi9ifvjk311.jpg,https://www.reddit.com/r/shittyfoodporn/comments/8qirw4/mods_are_gone_upvote_real_food_porn/,['gross']
81,61kqj5.jpg,This lovely cake for a one year old. (x-post /r/crappydesign),https://i.redd.it/fsj7t7perhny.jpg,https://www.reddit.com/r/shittyfoodporn/comments/61kqj5/this_lovely_cake_for_a_one_year_old_xpost/,['bad exe']
82,65q02s.jpg,"Poached rabbit's egg, served with fresh herbs",https://i.redd.it/zbwam6490yry.jpg,https://www.reddit.com/r/shittyfoodporn/comments/65q02s/poached_rabbits_egg_served_with_fresh_herbs/,['good exe']
83,di9wu8.jpg,"""Exotic salad"" - store near me",https://i.redd.it/42b7hsj99qs31.jpg,https://www.reddit.com/r/shittyfoodporn/comments/di9wu8/exotic_salad_store_near_me/,['bad exe']
84,9cfqpp.jpg,My dad got mad at a pizza he was making and threw it at our fence,https://i.redd.it/22egrr699wj11.jpg,https://www.reddit.com/r/shittyfoodporn/comments/9cfqpp/my_dad_got_mad_at_a_pizza_he_was_making_and_threw/,['bad exe']
85,7v95ib.jpg,"Finally got banned from /r/food... My ""4 day baked potato"", recipe in comments.",https://i.redd.it/sp4360nb59e01.jpg,https://www.reddit.com/r/shittyfoodporn/comments/7v95ib/finally_got_banned_from_rfood_my_4_day_baked/,['burnt']
86,794jvj.jpg,My daughter's school handed out trail mix to all the kids in her class,https://i.imgur.com/pERw3Rr.jpg,https://www.reddit.com/r/shittyfoodporn/comments/794jvj/my_daughters_school_handed_out_trail_mix_to_all/,['bad exe']
87,6ilvvv.jpg,"Yesterday, I ordered a Grilled Chicken sandwich for my lunch at the drive through. Wondered why it was so chewy. Wonder no more. Raw!",http://i.imgur.com/0FmwfWy.jpg,https://www.reddit.com/r/shittyfoodporn/comments/6ilvvv/yesterday_i_ordered_a_grilled_chicken_sandwich/,['bad exe']
88,d6i7a6.jpg,The Instant Pot Facebook community is a curse,https://i.redd.it/4b2i9imwgln31.jpg,https://www.reddit.com/r/shittyfoodporn/comments/d6i7a6/the_instant_pot_facebook_community_is_a_curse/,['overkill']
89,9fs1b0.jpg,"This 'vegan pizza' a friend got after an hour's wait, for £9.",https://i.redd.it/7a2emmpfi7m11.jpg,https://www.reddit.com/r/shittyfoodporn/comments/9fs1b0/this_vegan_pizza_a_friend_got_after_an_hours_wait/,['bad exe']
90,cuu6go.jpg,My friend made a “hedgehog” for her 14-year old son’s birthday,https://i.redd.it/k8xw6d0zrei31.jpg,https://www.reddit.com/r/shittyfoodporn/comments/cuu6go/my_friend_made_a_hedgehog_for_her_14year_old_sons/,['bad exe']
91,9bwl2l.jpg,2 days until payday Alexa play despacito,https://i.redd.it/obxfz012chj11.jpg,https://www.reddit.com/r/shittyfoodporn/comments/9bwl2l/2_days_until_payday_alexa_play_despacito/,['poor man']
92,7pcwuf.jpg,Ordered Sushi in Pakistan,https://i.redd.it/u4lo2iabw5901.jpg,https://www.reddit.com/r/shittyfoodporn/comments/7pcwuf/ordered_sushi_in_pakistan/,['bad exe']
93,8juzxd.jpg,I made a Spaghetti-O Jello Mold for my company pot luck...,https://i.imgur.com/fzjkyMf.jpg,https://www.reddit.com/r/shittyfoodporn/comments/8juzxd/i_made_a_spaghettio_jello_mold_for_my_company_pot/,['good exe']
94,bd58lf.jpg,The tripple gooberry sunrise from spongebob,https://i.redd.it/syjjsf77n9s21.jpg,https://www.reddit.com/r/shittyfoodporn/comments/bd58lf/the_tripple_gooberry_sunrise_from_spongebob/,['bad exe']
95,dqx8se.jpg,I was unpacking dishes and realized I never use some of them,https://i.imgur.com/INqyfEb.jpg,https://www.reddit.com/r/shittyfoodporn/comments/dqx8se/i_was_unpacking_dishes_and_realized_i_never_use/,['overkill']
96,cirafm.jpg,I made plain sushi,https://i.redd.it/k68b6kddwyc31.jpg,https://www.reddit.com/r/shittyfoodporn/comments/cirafm/i_made_plain_sushi/,['poor man']
97,c96nbi.jpg,White Trash Charcuterie,https://i.redd.it/xsuscfm39c831.jpg,https://www.reddit.com/r/shittyfoodporn/comments/c96nbi/white_trash_charcuterie/,['poor man']
98,att04u.jpg,By the power of Grayskull,https://i.redd.it/bbr1zrdvw9i21.jpg,https://www.reddit.com/r/shittyfoodporn/comments/att04u/by_the_power_of_grayskull/,['good exe']
99,6m2g5y.jpg,Hawaiian Pringles,https://i.redd.it/sjdmnjndse8z.jpg,https://www.reddit.com/r/shittyfoodporn/comments/6m2g5y/hawaiian_pringles/,['gross']
100,cn55t0.jpg,"My coworker said my breakfast belongs on this page, well does it?",https://i.redd.it/jmimzhi4t0f31.jpg,https://www.reddit.com/r/shittyfoodporn/comments/cn55t0/my_coworker_said_my_breakfast_belongs_on_this/,['poor man']
101,6ncaeh.jpg,At least they don't build up your expectations,http://i.imgur.com/17YngCm.jpg,https://www.reddit.com/r/shittyfoodporn/comments/6ncaeh/at_least_they_dont_build_up_your_expectations/,['bad exe']
102,hv73z6.jpg,Cinnamon Toast Crunch &amp; Vanilla Ice Cream. It’s SO GOOD!,https://i.redd.it/z3e2ux22n7c51.jpg,https://www.reddit.com/r/shittyfoodporn/comments/hv73z6/cinnamon_toast_crunch_vanilla_ice_cream_its_so/,['bad exe']
103,7qcb1l.jpg,Can I get extra pickles?,https://i.redd.it/djyunmglt1a01.jpg,https://www.reddit.com/r/shittyfoodporn/comments/7qcb1l/can_i_get_extra_pickles/,['gross']
104,8be6ss.jpg,"Turns out when cooked, reeses pieces dont melt, they just kinda open up like shellfish.",https://i.redd.it/59s8jk08b7r01.jpg,https://www.reddit.com/r/shittyfoodporn/comments/8be6ss/turns_out_when_cooked_reeses_pieces_dont_melt/,['overkill']
105,7jmdyr.jpg,"Ever wondered what the contents of a garbage disposal taste like? Suspend hot dogs, celery, olives, &amp; pimientos in jellied beef consommé.",https://i.imgur.com/ObJr8ZR.jpg,https://www.reddit.com/r/shittyfoodporn/comments/7jmdyr/ever_wondered_what_the_contents_of_a_garbage/,['good exe']
106,d8wctz.jpg,Charcuterie tonight,https://i.redd.it/cbhljvqa5no31.jpg,https://www.reddit.com/r/shittyfoodporn/comments/d8wctz/charcuterie_tonight/,['poor man']
107,6ulrvt.png,The thin line between genius and insanity is this sandwich,https://i.redd.it/4hn7xdio3lgz.png,https://www.reddit.com/r/shittyfoodporn/comments/6ulrvt/the_thin_line_between_genius_and_insanity_is_this/,['odd']
108,b2wdzb.jpg,Baked beans spring rolls,https://i.imgur.com/BVJswCE.jpg,https://www.reddit.com/r/shittyfoodporn/comments/b2wdzb/baked_beans_spring_rolls/,['gross']
109,91uibs.jpg,"I google'd Denny's Steak out of curiosity, found this abomination in someone's yelp review.",https://i.redd.it/74q2we0s15c11.jpg,https://www.reddit.com/r/shittyfoodporn/comments/91uibs/i_googled_dennys_steak_out_of_curiosity_found/,['bad exe']
110,g24iq3.jpg,Made some masks,https://i.redd.it/h9u2cyc5s2t41.jpg,https://www.reddit.com/r/shittyfoodporn/comments/g24iq3/made_some_masks/,['gross']
111,8nxfoq.jpg,"First attempt at gluten free, dairy free cupcakes",https://i.redd.it/drq8qpklwh111.jpg,https://www.reddit.com/r/shittyfoodporn/comments/8nxfoq/first_attempt_at_gluten_free_dairy_free_cupcakes/,['burnt']
112,dhqkxp.jpg,In a Cooking Facebook group.,https://i.redd.it/jbctclttdis31.jpg,https://www.reddit.com/r/shittyfoodporn/comments/dhqkxp/in_a_cooking_facebook_group/,['gross']
113,d45ogr.jpg,I present you to Ramen Carbonara,https://i.redd.it/fsqo34w5ikm31.jpg,https://www.reddit.com/r/shittyfoodporn/comments/d45ogr/i_present_you_to_ramen_carbonara/,['good exe']
114,916x31.jpg,whatever’s leftover in the house ramen,https://i.redd.it/uebs7ucr5pb11.jpg,https://www.reddit.com/r/shittyfoodporn/comments/916x31/whatevers_leftover_in_the_house_ramen/,['poor man']
115,8q3473.jpg,Ordered a veggie sub with olives and they delivered,https://i.redd.it/duvt0uu748311.jpg,https://www.reddit.com/r/shittyfoodporn/comments/8q3473/ordered_a_veggie_sub_with_olives_and_they/,['gross']
116,7oz07c.jpg,"Facebook finally delivered. Titled ""Breakfast on the go.""",https://i.redd.it/bz288s8cyu801.jpg,https://www.reddit.com/r/shittyfoodporn/comments/7oz07c/facebook_finally_delivered_titled_breakfast_on/,['overkill']
117,bmwptn.jpg,KFC Big Salmonella Sandwich,https://i.imgur.com/iFiE6yd.jpg,https://www.reddit.com/r/shittyfoodporn/comments/bmwptn/kfc_big_salmonella_sandwich/,['bad exe']
118,ckoiia.jpg,"Yes, please do take notes...",https://i.redd.it/cxxw0f47cud31.jpg,https://www.reddit.com/r/shittyfoodporn/comments/ckoiia/yes_please_do_take_notes/,['gross']
119,7m2nbp.jpg,Who's ready for Christmas morning waffles?,https://i.redd.it/vllu27e5z3601.jpg,https://www.reddit.com/r/shittyfoodporn/comments/7m2nbp/whos_ready_for_christmas_morning_waffles/,['burnt']
120,d1kpxg.jpg,Meal prepping isn’t that hard.,https://i.redd.it/qetk7s00bhl31.jpg,https://www.reddit.com/r/shittyfoodporn/comments/d1kpxg/meal_prepping_isnt_that_hard/,['odd']
121,6gwqly.jpg,I ordered a side of fries,https://i.redd.it/bbddss3ugb3z.jpg,https://www.reddit.com/r/shittyfoodporn/comments/6gwqly/i_ordered_a_side_of_fries/,['good exe']
122,d9hw7c.jpg,You fuckin' what‽,https://i.imgur.com/x5eHz3z.jpg,https://www.reddit.com/r/shittyfoodporn/comments/d9hw7c/you_fuckin_what/,['gross']
123,95mpv8.jpg,Box of meats from Hungary that took six weeks to deliver,https://i.imgur.com/w2Dfo5W.jpg,https://www.reddit.com/r/shittyfoodporn/comments/95mpv8/box_of_meats_from_hungary_that_took_six_weeks_to/,['gross']
124,bhy2tt.jpg,This charcuterie board I often make for my daughter.,https://i.redd.it/v6eb7gvtisu21.jpg,https://www.reddit.com/r/shittyfoodporn/comments/bhy2tt/this_charcuterie_board_i_often_make_for_my/,['poor man']
